"","Composer","Text"
"1","Mahler","Shutter Island<U+FEFF>"
"2","Mahler","Who could not like this. <U+00A0>It was also nice in the movie ""Shutter Island"" as part of the soundtrack.<U+FEFF>"
"3","Mahler","beautiful! the first time I heard this piece was a Monzo midi-record (!), made 5-12-2008, do you know if there are earlier records -performances with musical instruments?<U+FEFF>"
"4","Mahler","I first was introduced to this haunting beautiful piece while watching ""Shutter Island"" This Quartet does a breathtaking performance of this piece!!!  Bravo!
 <U+FEFF>"
"5","Mahler","Such beautiful Romantic piece of ART........    ;,)<U+FEFF>"
"6","Mahler","this is post perfection !!<U+FEFF>"
"7","Mahler","Shutter Island<U+FEFF>"
"8","Mahler","Magnifique interpretation... ! <3<U+FEFF>"
"9","Mahler","i am the guy who turns the pages. any questions?<U+FEFF>"
"10","Mahler","My god how can some one dislike this? like silvery wine flowing on a spaceship, a bird of rarest spun metal! <U+FEFF>"
"11","Mahler","ah...there are some musicians behind the mics :-)
<U+FEFF>"
"12","Mahler","I also was introduced to this little gem by the movie, ""Shutter Island"". Now, my world of classical music has me diving into hitherto unknown string quartets! A good performance! Wish I could have been in the front row for this one!<U+FEFF>"
"13","Mahler","9:35 I didn't know Matt LeBlanc played cello. <U+FEFF>"
"14","Mahler","this performance is absolutely incredible! well done, you've perfected one of my favorite pieces, and now I account for about the last 1000 views!<U+FEFF>"
"15","Mahler","Estupendo!! <U+FEFF>"
"16","Mahler","Such a breathtaking, good performers although something happened in the performance,  well live is live always. Bruckner has both a string quintet and quartet if someone didn´t know
<U+FEFF>"
"17","Mahler","Brilliant and heartfelt performance! Thanks for sharing.<U+FEFF>"
"18","Mahler","Magnifico. Gracias.<U+FEFF>"
"19","Mahler","EXQUISITE Performance !  
 Mahler @ age 16 !!!<U+FEFF>"
"20","Mahler","Beautiful.  Simply beautiful.<U+FEFF>"
"21","Mahler","Im 15, and this is actaully my favorite song. I listen to it repeatedly. It is beautiful!<U+FEFF>"
"22","Mahler","Bravo...<U+FEFF>"
"23","Mahler","Everything is perfect, right down to the venue and its backdrop--what a treat to discover this amazing performance on Mahler's 151st birthday!<U+FEFF>"
"24","Mahler","@PianoHero1994 I think it's ironic, because classical music (especially in the late 19th century and early 20th), a lot of composers and pieces wrote pieces which I felt could easily relate to the anxiety and adolescent conflicts. Modern pop and hip hop are so devoid of authenticity and emotion I would think they would make poor outlets for young and troubled minds.<U+FEFF>"
"25","Mahler","Heartbreaking<U+FEFF>"
"26","Mahler","that piano opening always reminds me of ""building steam with a grain of salt"" dj shadow<U+FEFF>"
"27","Mahler","The first time I heard this was from ""Shutter Island"" but it is now one of my favorite pieces!<U+FEFF>"
"28","Mahler","@PianoHero1994i love classical music..im 19. but yah i know what you mean FUCK JUSTIN BIEBER<U+FEFF>"
"29","Mahler","@PianoHero1994 
It's because they allow others to influence them too much.
And doing that they'll only listen to their modern music and not stop to listen to other kinds.
I'm a teen and am proud to enjoy both classical and rock.<U+FEFF>"
"30","Mahler","So beautiful, I have no words. Why is classical music so under appreciated by teens? Honestly hardly any teens listen to music of this level of beauty. Its a real shame. <U+FEFF>"
"31","Mahler","So beautiful!<U+FEFF>"
"32","Mahler","the great thing about classical pieces like this (i also love symphony no.6 by mahler - also very dark and powerful) is that because there are no words, nothing parts you from the music (in my understanding the language of the soul, the feeling). Everyone associates something different with words, and you can never really tell what you feel, there's always a lost part. It feels like a beautiful memory from your lost childhood, like a distant homeland and it's forgotten magical language.
<U+FEFF>"
"33","Mahler","good job<U+FEFF>"
"34","Mahler","<U+627E>了<U+5F88>久了<U+FEFF>"
"35","Mahler","I COULD NOT SAY A WORD FOR THE MUSIC~~~~AMAZING~<U+FEFF>"
"36","Mahler","wonderful！！！！！！！！！I COULD NOT SAID A WORD FOR THE MUSIC~<U+FEFF>"
"37","Mahler","wonderful！！！！！！！！！！！！！！！！！！！！！！！！！<U+FEFF>"
"38","Mahler","Now we are preparing  CDs ""Piano Quartets by Beethoven, G.Mahler and J.Turina"" and ""Two Great String Quartets by Beethoven No. 4 Op.18, No.4 and String Quartet Op.132"" <U+FEFF>"
"39","Mahler","@FlamencoPuro1 His symphonies are actually incredible. Probably one of the most intimate composers on an orchestral level. The colours and textures and emotions he achieves in his large scale works are ethereal. <U+FEFF>"
"40","Mahler","@superdevan makes you want to give up everything lol. Such a deep piece...<U+FEFF>"
"41","Mahler","好演奏！<U+FEFF>"
"42","Mahler","Mahler's quartet is such a treasure! I had no idea that he composed music at this level of intimacy.<U+FEFF>"
"43","Mahler","I love the surroundings and atmosphere.... makes this piece all the more wonderful !! Love you Mahler. <U+FEFF>"
"44","Mahler","This is just... Magnificent.
Simply Magnificent.
Best performance of this piece I've ever seen!<U+FEFF>"
"45","Mahler","Thanks!!!!!<U+FEFF>"
"46","Mahler","@Lukecash12  Totally agree, this is by far the most profound and amazing performance of that piece I ever heard, so moving. I have to look up these guys, they are so good<U+FEFF>"
"47","Mahler","Wonderful performane!
i didn't know this beautiful piece before watchig the movie Shutter Island.<U+FEFF>"
"48","Mahler","Wonderful performane!
i didn't know this beautiful piece before watchig the movie Shutter Island.<U+FEFF>"
"49","Mahler","Beautiful.<U+FEFF>"
"50","Mahler","Beautiful.<U+FEFF>"
"51","Mahler","yes 15 or 16.
Very deep and full of emotion<U+FEFF>"
"52","Mahler","Same thing here! I was doing Mahler's 8th Symphony (in the choir). A friend of mine and I was watching this and I knew this was Mahler straight away! And whispered to him, this is Mahler! And Leonardo said, ""it's Mahler."" Haha.<U+FEFF>"
"53","Mahler","Wow this is so amazingly played<U+FEFF>"
"54","Mahler","Wowowowowowow is all I can say!!! Why haven't I heard of you guys before! ABSOLUTELY DIVINE!!!<U+FEFF>"
"55","Mahler","I'm the staff accompanist at Providence College, and will be performing this on a student recital.  What a wonderful resource YouTube is!  Great piece, great performance!<U+FEFF>"
"56","Mahler","Amazing performance. Perfect balance of dynamics, no one part dominates, and each rises above the others for a moment or two to interject into the piece.<U+FEFF>"
"57","Strauss","0:00    Introduction 
6:02    Theme: Don Quixote (pg 21)
7:05    Theme: Sancho Panza (pg 21)
8:13    Variation 1: Das Abenteur mit den Windmuhlen (pg 23)
10:48  Variation 2: Der Kampf gegen die Hammelherde (pg 30)
12:22  Variation 3: Gesprache zwischen Ritter und Knappe (pg 35)
16:16      Viel Langsamer (pg 44)
19:51  Variation 4: Das Abenteur mit der Prozession von Bussern (pg 53)
21:50  Variation 5: Don Quixotes Wacht in der Sommernacht (pg 57)
25:56  Variation 6: Die verzauberte Dulzinea (pg 59)
27:13  Variation 7: Der Ritt durch die Luft (pg 62)
28:26  Variation 8: Die Fahrt auf dem verzauberten Nachen [Barcarolle] (pg 68)
30:11  Variation 9: Der Kampf gegen die vermeintlichen Zauberer (pg 76)
30:18  Variation 10: Zweikampf mit dem Ritter vom blanken Monde (pg 77)
35:15  Finale: Don Quixotes Tod (pg 88)


Viola Solo 13:58 (rehearsal No 29)

Score and Parts free here: http://imslp.org/wiki/Don_Quixote,_Op.35_(Strauss,_Richard)<U+FEFF>"
"58","Strauss","C'est un veritable regal , y compris de la part de l'altiste soliste peut etre un peu trop reserve...Bravo!<U+FEFF>"
"59","Strauss","Richard Strauss, a pure genius.....
Wonderful performance by the great<U+00A0>Mischa Maisky and the superb conductor Sawallisch.
Many thanks for posting it.....<U+FEFF>"
"60","Strauss","Glorious account of The Don, Mischa Maisky and Sawallisch are both outstanding. This is the most beautiful and wondrous of Strauss' many tone poems and other orchestral works (with the possible exception of Tod Und Verklarung, and maybe Also Sprach Zarathustra). Extraordinary performances all around. The violist might be a little lacking in personality but otherwise does an excellent job.<U+FEFF>"
"61","Strauss","amo-te Strauss<U+FEFF>"
"62","Strauss","Fantastic!!!<U+FEFF>"
"63","Strauss","This is a very good performance of Richard Strauss ' tone poem Don Quixhote, a rich and glorious work given a virtuoso and subtle performance by both soloists, the NHK Orchestra from Japan under the supremely commanding and musical direction of Wolfgang Sawallisch.<U+FEFF>"
"64","Strauss","E excelente<U+FEFF>"
"65","Strauss","mischa maisky!<U+FEFF>"
"66","Strauss","BELLISIIMO!<U+FEFF>"
"67","Strauss","Flashy shirt. I love it.<U+FEFF>"
"68","Strauss","GRAN OBRA<U+FEFF>"
"69","Strauss","Without music, life would be a mistake and this is what he mean.<U+FEFF>"
"70","Strauss","cymbal player, ew.  gross.<U+FEFF>"
"71","Strauss","Good orchestra!<U+FEFF>"
"72","Strauss","Hombre, estos poemas sinfonicos son tan adecuados, que genial compositor, el mejor compositor del siglo XX, estoy de acuerdo con Glenn Gould, es qu esu musica tiene todo, atonalidad y tonalidad, expresionismo, impresionismo, romanticismo e incluso dodecafonismo en algunas partes<U+FEFF>"
"73","Strauss","Amazing! Love Strauss x<U+FEFF>"
"74","Strauss","I'm really drawn to the Don--he's such an idealist--and Strauss really captures<U+00A0>his personality in music<U+FEFF>"
"75","Strauss","DELICIOSA MUSICA<U+FEFF>"
"76","Strauss","Don Quixote changes the spear for the cello  bow, more peaceful.<U+FEFF>"
"77","Strauss","Sawallisch e splendido dirigendo questo poema sinfonico.<U+FEFF>"
"78","Strauss","WOW<U+FEFF>"
"79","Strauss","Which orchestra is this?<U+FEFF>"
"80","Strauss","Very good performance!<U+FEFF>"
"81","Strauss","The ending, around 35 and a half minutes in, faintly reminds me of the end of the first movement of Brahms' Second Symphony...<U+FEFF>"
"82","Strauss","O sonho e o alivio das miserias dos que as tem acordados... Cervantes<U+FEFF>"
"83","Strauss","A worthy interpretation of this great work.<U+00A0><U+FEFF>"
"84","Strauss","is that John Turturro?<U+FEFF>"
"85","Strauss","whats the name of the violist?<U+FEFF>"
"86","Strauss","10:50<U+FEFF>"
"87","Strauss","wunderbar !!!<U+FEFF>"
"88","Strauss","Which orchestra, please?<U+FEFF>"
"89","Strauss","Poor performance by the violist...<U+FEFF>"
"90","Strauss","well it was 10/10 until maisky showed up<U+FEFF>"
"91","Debussy","Dear Jin Cho, this is one of the most beautiful interpretations of Clair de lune I have ever hear. Beautiful phrasing and beautiful choreography of your wrists and hands on the keyboard. Bravo to you.Seymour Bernstein<U+FEFF>"
"92","Debussy","Right now, it is 5:07 am, dark outside, i can here the rain hitting my rooftop and dripping off the roof, and here i am, cozy, in my warm bed and pj’s, listening to this beautifully interpreted piece performed by an amazing pianist. Life could not be more perfect at this moment.<U+FEFF>"
"93","Debussy","This is how I imagine watercolors to sound like<U+FEFF>"
"94","Debussy","He is not playing, he is kissing the keyboard with his fingers!<U+FEFF>"
"95","Debussy","Honestly when I'm on my deathbed (if I make it there) I want this playing so I can let myself go.<U+FEFF>"
"96","Debussy","I have never heard this piece played like this. Its amazing.<U+FEFF>"
"97","Debussy","Exquisite performance played the way I think it was exactly what Debussy had in mind when he wrote it.<U+FEFF>"
"98","Debussy","When there's no audience, when the musician is completely relaxed, when there's enough purity and the ego is out of the way, the most sublime vibrations of the soul manifest themselves. You are God's instrument when you interpret this piece  ...<U+FEFF>"
"99","Debussy","I feel like this song has a lot of emotions it's like a story without words :v pure Art<U+FEFF>"
"100","Debussy","Amazing playing. You had my 6th grade class of 30 students in complete silence and awe<U+FEFF>"
"101","Debussy","Extraordinary...so many pianists bucher this master piece with a soulless performance. Happy to hear someone who truly feel this beautiful music. When you,as a pianist, can imagine the moon playing hide and seek with clouds in a dark night, you fully understand ''clair de lune''.Each note should be an unexpected ray of light through the clouds. There is a kind of chaos in this music, unplanned emotional bursts. And that's why it is very hard to play. It's not about technics, it's about feelings<U+FEFF>"
"102","Debussy","I don't want to sound weird here, but this young man played Clair de lune by making love to it while playing. By the way just one word from me to sum his performance . . . Perfect!<U+FEFF>"
"103","Debussy","This should have millions of views<U+FEFF>"
"104","Debussy","how can anyone dislike this?? T.T<U+FEFF>"
"105","Debussy","Chopin Playing Debussy<U+FEFF>"
"106","Debussy","Talking to the moon...<U+0001F318><U+FEFF>"
"107","Debussy","Best version I ever heard.<U+FEFF>"
"108","Debussy","Definitely the best performance of Clair De Lune in YouTube.<U+0001F44F><U+0001F3FB><U+0001F44F><U+0001F3FB><U+0001F44F><U+0001F3FB><U+FEFF>"
"109","Debussy","I was very fortunate to see him play this in concert as an encore. I know this piece well but he made it new for me. Thanks for sharing.<U+FEFF>"
"110","Debussy","superb light touch best piano performance of this I've heard<U+FEFF>"
"111","Debussy","My god that was sob worthy. This has to be the most beautiful pieces ever written for the piano.<U+FEFF>"
"112","Debussy","Everything he plays is brilliant. I’m convinced he’s mastered everything from the romantic era<U+FEFF>"
"113","Debussy","He plays this as if he is inhaling and exhaling moonlight. His performance truly pierces my heart - BRAVO!<U+FEFF>"
"114","Debussy","FINALLY!!! Someone who plays the exquisite Clair De Lune the way my dear mother played it... with depth of emotion... with feeling... with their heart. SO pleased to have found this performance. Much gratitude & a heartfelt thank you.<U+0001F495><U+0001F495><U+0001F495><U+FEFF>"
"115","Debussy","This piece makes me appreciate life and how grateful I am to still be alive having my family and friends <U+2764><U+FE0F> just PRECIOUS<U+FEFF>"
"116","Debussy","피아니스트의 마음이 실려있는 영롱한 달빛이 쏟아져내리네요...오늘 어지러운 제 맘을 씻기우는 고마운 피아노 소리입니다..<U+FEFF>"
"117","Debussy","Que talento, bellisimo.<U+FEFF>"
"118","Debussy","Una vez escuchando a cho quisiera que el tocara todas las obras. Es realmente impresionante.<U+FEFF>"
"119","Debussy","I firmly believe that from now on, this will be the definitive be all and end all recording of this piece, idk how more beautiful and magestic can you get than this, I used to like this piece but not ""love"" it so much because I was never convinced enough, now I am tho, his sound is just on freaking point!!!<U+FEFF>"
"120","Debussy","Wow!  Really gentle and yet charged with a deep power.. Best performance of this tune I've heard without doubt.. So many people rush it, when it's all about the lingering notes :) 
I'm learning it myself at the moment, and now realise, after hearing this, that my attempts are like a noisy fog horn floundering in the dark at sea!  But with this performance of it here, my determination to learn it well  has been infused with a most incredible inspiration. Thank you so much! :)<U+FEFF>"
"121","Debussy","The tenderness of his playing.... I was afraid to exhale for fear of affecting the moment.  A living person is capable of something so stunning, what can't we do?<U+FEFF>"
"122","Debussy","The best interpretation of this work that I have ever heard.<U+FEFF>"
"123","Debussy","Divine. Absolute perfection.<U+FEFF>"
"124","Debussy","Wonderful brought me near tears. What a splendid performance. And Mr. Bernstein is correct, this IS the most  beautiful interpretation of Clair de lune I have ever heard also. Wonderful!<U+FEFF>"
"125","Debussy","he's incredibly lovely...<U+FEFF>"
"126","Debussy","I am speechless. Such a delicate and pensive interpretation of this piece. Beautifully done Seong-jin Cho.<U+FEFF>"
"127","Debussy","This reminds me of my childhood for some reason... walking hand in hand with my mom to swim on a midsummer night<U+FEFF>"
"128","Debussy","serene, peaceful, touching, absolutely gorgeous indeed.<U+FEFF>"
"129","Debussy","Absolutely amazing. Helps keep my stress levels down and puts me in a calm state of mind.<U+FEFF>"
"130","Debussy","I think I'm in heaven.<U+FEFF>"
"131","Debussy","Magnifique interpretation. Parmi les meilleures que j ai eu l occasion d ecouter. Quel talent chez ce jeune pianiste ! C est romantique a souhait ! On reve !<U+FEFF>"
"132","Debussy","Beautiful! Is my favorite piano piece<U+FEFF>"
"133","Debussy","Dear Cho, this is my favorite interpretation of Clair de Lune.  You've made an already-beautiful piano piece become absolutely ethereal.  Thank you so much for sharing your gift with the world.  I honestly think you'll be regarded as one of the greatest pianists of the 21st century.<U+FEFF>"
"134","Debussy","Who in their right mind would not like this??146 thumbs down! !!! No class<U+0001F626><U+FEFF>"
"135","Debussy","The best interpretation I have ever heard...plays even the subtle parts (eg 3:07-3:09) with so much precision<U+FEFF>"
"136","Debussy","This is the most beautiful rendition out there on youtube.<U+FEFF>"
"137","Debussy","The measured poise and staunch discipline with which this man plays this piece is precisely the measure of respect that this music deserves.  Over eager, perhaps too preoccupied with impressing others with their fast playing, musicians rush headlong into the crescendo, fingers flying, with no regard for the listener.  Descending into a deep and muddy quagmire of disjointed noise, their renditions could be mistaken for a metal concert.  This man plays in such a way that every note rings true as intended: Clear, harmonic, concise, purposeful, powerful.  The result is nothing short of a masterfully-executed, faithful reproduction of the masterpiece that Debussy himself imagined.  This is because he played it for himself.  No theater.  No dramatics.  No whimsical hand movements or contorted facial expressions, just fingers on keys.  Well done.<U+FEFF>"
"138","Debussy","와.... 내가 치는 달빛은 달빛이아니라 고작 백열등 빛 수준이였구나.... 
분명 똑같은 곡인데도 어쩜 이렇게 섬세하고 아름답게 들리는 건지...ㅠ ㅠ ㅠ ㅠ 정말 최고의 횽~~<U+FEFF>"
"139","Debussy","The greatest rendition of Clair I have ever heard. In tears trying to drink my morning coffee. Thank you for this.<U+FEFF>"
"140","Debussy","Lovely<U+FEFF>"
"141","Debussy","I need somebody to explain me why this piece brings me to tears everytime I hear it... There´s something sublime about it, you can easily dream away involved with its soft and tender rhythm. But please, tell me, in musical terms, what´s behind the sensations ""Clair de lune"" arouses.<U+FEFF>"
"142","Debussy","4:47 onwards is how I imagine the good in the human race, the way we can pull together and be complete. Such a feeling of absolute happiness and at the same time a feeling of something uncertain maybe not knowing what is.<U+FEFF>"
"143","Debussy","The song alone makes me very emotional but seeing another human being playing it so elegantly... made me tear up and smile many times throughout the video :) beautiful, thank you!<U+FEFF>"
"144","Debussy","Wanted to learn this piece since I was a kid. Tried today and sloppily made the first 2 pages. Listens to this and now I wonder why i am even playing<U+0001F606><U+0001F606><U+0001F606><U+FEFF>"
"145","Debussy","I absolutely am in love with when the first low low octaves are introduced followed be high descending notes - it’s gorgeous<U+FEFF>"
"146","Debussy","I really acknowledge the amount of time and expression he put into this piece. Each note is played so delicately, absolutely beautiful<U+FEFF>"
"147","Debussy","Moonlight

Your soul is a select landscape fair
Where charming masqueraders and bergamaskers go
Playing the lute and dancing and almost
Sad beneath their fantastic disguises.

All sing in a minor key
Of victorious love and the opportune life,
They do not seem to believe in their happiness
And their song mingles with the moonlight,

With the still moonlight, sad and beautiful,
Which gives the birds to dream in the trees 
And makes the fountain sprays sob in ecstasy, 
The tall, slender fountain sprays among the marble statues.

 Paul Verlaine<U+FEFF>"
"148","Debussy","Superb !!!<U+FEFF>"
"149","Debussy","dang he doesnt use the soft pedal wowowowowow<U+FEFF>"
"150","Debussy","Beautiful performance of Debussy's masterpiece. Cho puts so much care into each note, taking the listener on a fantastic journey filled with emotion.<U+FEFF>"
"151","Debussy","You have my favorite opening. I feel it more from you than the original on the low.<U+FEFF>"
"152","Debussy","I would definitely have to say that this is the most calm I have heard this piece. Absolutely beautiful interpretation. Wonderful arpeggios and it takes a certain type of musicianship to be able to play that piece as calming and peaceful as you did. Amazing<U+FEFF>"
"153","Debussy","two notes into this song, and I am already fighting back tears. This song is one of the most beautiful, most powerful songs I have ever heard. This man's rendition is absolutely excellent. Spot on!<U+FEFF>"
"154","Debussy","if anyone plays this for me they will instantly have my soul this is beautiful<U+FEFF>"
"155","Debussy","This is my favorite piece and I've heard many versions but this is probably the best<U+FEFF>"
"156","Debussy","the voicing is absolutely outstanding<U+0001F60D><U+0001F60D><U+0001F60D> it’s like you are not even trying<U+FEFF>"
"157","Debussy","Sobbing because it's the most brilliant rendition I have ever heard.<U+FEFF>"
"158","Debussy","Seong - Jin Cho,s exquisite performance gives me comfort and solace , and heals my tired mind and sorrow , and melts away my suffering and lamentation and anxiety , and purifies my stagnant soul .<U+FEFF>"
"159","Debussy","Like a summer breeze ..gentle ...soft .... warm .... Cho Seong-Jin plays so delicately you can almost reach out and touch the notes as the pass by ... beautiful<U+FEFF>"
"160","Debussy","Pure bliss. One of my favourite renditions of this piece.<U+FEFF>"
"161","Debussy","Currently 12:43 and i am now looking at my lamp as if it was the moon giving light because the moon is on the opposite side of my house so i cant look out my window to see it so i have to pretend the lamp is my moon<U+0001F61E><U+FEFF>"
"162","Debussy","This gives me new faith in youtube. if only everything we see on this platform<U+00A0>and in life had the same effect.  WOW.<U+FEFF>"
"163","Debussy","Its like water  poured into his hands and running through his fingers<U+FEFF>"
"164","Debussy","필요이상으로 섬세해서 유약하게까지 들릴지경이네..프랑스유학후부터 음악이 더 날카로와졌다고 느꼈는데  지금은 그 경지를 초월해서 약간 범우주적인느낌이다ㅠㅠ<U+FEFF>"
"165","Debussy","He takes all of the darkness of the night out of it; his interpretation sounds as though it was meant for a beautiful Spring day<U+FEFF>"
"166","Debussy","Great song. Love and peace from the United States.<U+FEFF>"
"167","Debussy","It's just like you sitting on a chair, in a beautiful forest full of colourful flower while hearing him playing this song<U+FEFF>"
"168","Debussy","thanks for putting me in such a peace. This is the best interpretation of the beautiful music. I will be listening to your music on my last day here pondering what my life has been. You just made such an ugly world so beautiful.<U+FEFF>"
"169","Debussy","This is sublime! Watch his hands, they barely move. Total immersion into the music.<U+FEFF>"
"170","Debussy","It sounds as if he was drawing moon lights using piano... I feel like  I could see the reflection on the surface of the water with my eyes closed...<U+FEFF>"
"171","Debussy","So delicate...so fluid...gorgeous <3<U+FEFF>"
"172","Debussy","This is definitely one of the most beautiful renditions of this piece I ever heard. He plays it so beautifully.<U+FEFF>"
"173","Debussy","Impressionnant, sous le charme.<U+FEFF>"
"174","Debussy","So beautiful! Debussy Clair de Lune was my mother's favorite.<U+FEFF>"
"175","Debussy","I always thought perfection wasn't of this world. I was wrong.<U+FEFF>"
