"","Composer","Text"
"934","Stravinsky","Conductor is a maniac. Almost a Nazi version. Very dark balance in the opening - powerful rhythms but maybe not enough top-end fizz for this piece. I'm just talking about the beginning.<U+FEFF>"
"935","Stravinsky","cool<U+FEFF>"
"936","Stravinsky","17:00<U+FEFF>"
"937","Stravinsky","Interesting in parts and some melodies, but the whole work is just a vulgar bag of sounds  with no sense.<U+FEFF>"
"938","Stravinsky","Perfect!<U+FEFF>"
"939","Stravinsky","Wow!<U+FEFF>"
"940","Stravinsky","7:16 I'm crying<U+FEFF>"
"941","Stravinsky","The ending trumpets get me everytime....Go! PETRUSHA<U+FEFF>"
"942","Stravinsky","serate di agosto in onore di s.Nicolo Politi di Adrano<U+FEFF>"
"943","Stravinsky","17:00<U+FEFF>"
"944","Stravinsky","On a scale of 1-10, I give this piece of music AND performance a ""20""!!!!! Fantastic soloists!!! ""Infectuous""! If Petrouchka is still dancing around his bedroom with his coconut, there is a cure; ""Ach du lieber, mein schatz"", THERE IS !!! Thank you GOD for Stravinsky!!! I'll not sleep tonight! Hand me my ""coconut"" poleaze!!!!! ""Gesundheit""!<U+FEFF>"
"945","Stravinsky","Didn’t anybody else notice that in 6:07 the air conditioning turned the page of Emily Beynon’s music (principal flutist) and she just kept playing? Amazing!<U+FEFF>"
"946","Stravinsky","Bravo<U+FEFF>"
"947","Stravinsky","good!!!!!!!!!!<U+FEFF>"
"948","Stravinsky","nice music,<U+FEFF>"
"949","Stravinsky","Bravissimo someraldino<U+0001F3BA><U+0001F3BA><U+FEFF>"
"950","Stravinsky","Igor il grande!!!<U+FEFF>"
"951","Stravinsky","I just subscribed to U-tube at $9 per month and I cant get any sound 3#<U+FEFF>"
"952","Stravinsky","3:41<U+FEFF>"
"953","Stravinsky","I don't get it, is the piano playing the right part at 0:44?  The version I've been studying the piano is doing the harp/celeste/piano stuff and not the picc/oboe/trumpet melody.  Is there some updated version or something where the piano switches parts?  It's odd to me because in the (maybe) original the piano is out of place for the character of the melody--but that's just an opinion.  Still a brilliant and energetic performance.<U+FEFF>"
"954","Stravinsky","24:40<U+FEFF>"
"955","Stravinsky","<3<U+FEFF>"
"956","Stravinsky","love that the conductor shows every beat which helped me see the overall structure.<U+00A0> loved the sounds of the instruments.<U+00A0> they each were really full, winds, strings, brass, percussion.<U+00A0>nice balance and interplay. <U+00A0>great performance.<U+FEFF>"
"957","Stravinsky","La fresca musica de Stravinsky, nos lleva el mundo de la farandula con Petrouchka,<U+00A0> ballet anterior a la Consagracion de la primavera, que ya introducia el nuevo lenguaje del genial ruso. A pesar de las distancias, en esta veo a nuestro Manuel de Falla.<U+FEFF>"
"958","Stravinsky","...no cabe duda de que esta es una de las mejores orquestas del mundo, y el joven Nelsons (titular de la orquesta de Boston) es una estrella.-<U+FEFF>"
"959","Stravinsky","who else was here for 7:00 ?<U+FEFF>"
"960","Stravinsky","8:46 actully<U+FEFF>"
"961","Stravinsky","Interesting conducting<U+FEFF>"
"962","Stravinsky","This performance , this performance , the kingdom for this performance . <U+0001F34E><U+FEFF>"
"963","Stravinsky","The Igor Stravinsky’s ballet for the Ballet Russes was Petrushka: Ballet Burlesque in Four Scenes (Opus 16). The composer dedicated this ballet to his Russian friend, the artist and scenographer Alexandre Benois (1870-1960). Stravinsky worked in the composition while he was traveling in Lausanne, Clarens, Beaudie and Rome (August 1910 <U+2013> May 1911). In the first presentation (43’), the orchestra was conducted by Pierre Monteux (1875-1964), in the Theatre du Chatelet, in Paris (June 13, 1911). This charming and tragic ballet showed the drama of two puppets that a magician brought to life, in a pantomime that became a huge success in all the presentations. Sergey Diaghilev (1972-1929) received designs by Jacques-Emile Blanche (1861-1942), but chosed.to present the ballet with the costumes and scenery by Alexandre Benois (1870-1960). The choreographer was Michel Fokine (Mikhail Mikhailovich Fokin, c. 1880/1-1942), and the most important dancer was Vaslav Nijinsky (1889-1950), that danced au pair with Tamara Platnovna Kasarvina (1885-1978) as a mechanical doll. The Russian dancer Alexandre Orlov was the Moor that killed the lover Petrouchka (Nijinsky). The photo of the charming Kasarvina dressed as a doll, is reproduced (Shead, 1989, page 48). In the second presentation, Nijinsky dressed as Petrouchka posed with I. Stravinsky, and the photo is reproduced (Shead, 1989). Petrouchka was also presented in the north American tour of the Ballets Russes (1916). I loved this presentation of the Concertgebouw Orchestra, but I would like to have more informations about this presentation, for example when, where, etc... 
Selected bibliography:
Kennedy, M. (1985). The Oxford Dictionary of Music.  Oxford: Oxford University Press, p. 701.
Shead, R. (1989).  Ballets Russes.  Secaucus, New Jersey: Quarto Book, Wellfleet Press, pp. 10, 22-32, 37-62, 71, 74-75, 80-81, 100, 106-107, 119-120, 125, 154, 161-163.   
Thompson, K. (1973). A Dictionary of Twentieth Century Composers, 1911-1971.  London: Farber and Farber, pp. 566-606.<U+FEFF>"
"964","Stravinsky","That's one hell of a flautist.<U+FEFF>"
"965","Stravinsky","9:45<U+FEFF>"
"966","Stravinsky","26:17<U+FEFF>"
"967","Stravinsky","Trumpet solo: 17:06<U+FEFF>"
"968","Stravinsky","Nelsons is enthusiastic enough, and this is bright. There are a few strident horns that you wouldn't notice unless you heard this repeatedly, which I plan to do, as soon as I look up what Stravinsky meant by all of it. 
Don't be a hater. Don't hate people who hate. Try to love them. You don't have to completely love haters but just sometimes ""like"" people who hate. That way haters will feel less bad about themselves and maybe hate less.<U+FEFF>"
"969","Stravinsky","First time I listened to this . I'm suprised . I thought Stravinsky would be far more ""modern "" and "" difficult"" . Some of it sounds a bit like old film background music . I know a lot of European lesser kbown composers were draughted into Hollywood so maybe they were influenced by him .<U+FEFF>"
"970","Prokofiev","What other classical pieces would you love to see performed in this style?<U+FEFF>"
"971","Prokofiev","Duuu Duuu Du Du Du Di, DU DU DU DI, DI Du Du Du, Di Duuuuu Di Duuuu Di Duur?<U+FEFF>"
"972","Prokofiev","1:34 is where the song goes Duuu Duuu Du Du Du Di, DU DU DU DI, DI DU DU DU, Di Duuuuu Di Duuuu Di Duur in case anyone was wondering.<U+FEFF>"
"973","Prokofiev","Reddit brought you here wasn't it?<U+FEFF>"
"974","Prokofiev","Anyone from Reddit??<U+FEFF>"
"975","Prokofiev","This conductor is a natural storyteller both in his words and facial expressions.<U+FEFF>"
"976","Prokofiev","wtf that conductor is narrating AND conducting like a BOSS<U+FEFF>"
"977","Prokofiev","This takes me back. The sound of the French horns as the wolf still gives me chills.<U+FEFF>"
"978","Prokofiev","The crying baby in the audience being eaten by the wolf was my favorite part.<U+FEFF>"
"979","Prokofiev","Anyone else think the conductor reminds them of Anthony Hopkins?<U+FEFF>"
"980","Prokofiev","I am 24 and haven't heard peter and the wolf over 10 years.
This performance has played my heart string, making me grin of excitment like an idiot on the bus :)
Thank you all for a well made performance<U+FEFF>"
"981","Prokofiev","This is by far one of the best masterpieces to teach children to listen to and appreciate music. It gives each instrument a character and purpose. The story is beautiful told through the emotion of each instrument. It is a story told in sound.<U+FEFF>"
"982","Prokofiev","Brings me back to when I was 3, and my parents kept playing me this cassette over and over again<U+FEFF>"
"983","Prokofiev","Such a charismatic conductor and narrator. Wonderful performance by the VSO as well. Best recording of Peter and the Wolf I know.<U+00A0><U+FEFF>"
"984","Prokofiev","I'm using this video for my first graders! We're going to plan a ""day at the symphony"" where they get dressed up, bring ""tickets"" to class, and watch the video like they're going to see a real performance. I think they'll love it. Wonderful version - I don't think I could narrate and conduct at the same time!<U+FEFF>"
"985","Prokofiev","I'm japanese but it was easy to listen to<U+00A0>his English. I had a good time!
Thank you very much!!!!<U+FEFF>"
"986","Prokofiev","This took me back 30 years to watching the Disney cartoon version of this when I was a kid. What a fantastic narration and a  beautiful production.<U+FEFF>"
"987","Prokofiev","The conductor is such a good narrator!<U+FEFF>"
"988","Prokofiev","Why can't I like this more than once :(<U+FEFF>"
"989","Prokofiev","My granddad showed me this when I was very small. I remember listening to it for hours on end.<U+FEFF>"
"990","Prokofiev","I really like this...I wore out the record as a child.<U+FEFF>"
"991","Prokofiev","why is there always someone coughing in the background?<U+FEFF>"
"992","Prokofiev","I'm 18 and play in an amateur symphony orchestra, and this is going to be our last project this academic year. We'll be performing in a school, for students to hear, but for some damn stupid reason my university decided that that exact same day is the PERFECT day for my maths exam. I hate it. 
I really want to join the project because this piece is awesome, but looks like I have to choose the more important thing. Which is that exam that I'd rather have a week earlier.<U+FEFF>"
"993","Prokofiev","I really dont understand why someone wouldnt like this video. Ive been looking for a long time for a performance like that. This is marvelous.<U+FEFF>"
"994","Prokofiev","In the old version of Peter and the wolf Peter's grandpa pulls Peter by the ear, but in the new version Peter gets pulled by the hand<U+FEFF>"
"995","Prokofiev","This is fantastically wonderful in so many ways. Thank you all.<U+FEFF>"
"996","Prokofiev","Such a delightful performance. Those children in the audience are lucky to see it live!<U+FEFF>"
"997","Prokofiev","Put this on your iPod, or take it from your phone....put your headphones on.  Go for a walk through a shadowy landscape. Interesting, this shall be.<U+FEFF>"
"998","Prokofiev","I'm 41 and I haven't heard that for at least 30 odd years. I remember it like it was yesterday. My parents had it on vinyl back in the day. Great childhood memories :o)<U+FEFF>"
"999","Prokofiev","Someone doesn't like the french...<U+FEFF>"
"1000","Prokofiev","wonderful! Thanks for sharing this! I'm impressed that Tovey could narrate it and conduct at the same time (more or less). His Scots accent for the grandfather was quite funny! very well played. This piece should still be an experience that all kids enjoy.<U+00A0><U+FEFF>"
"1001","Prokofiev","I always picture Scut Farkas (the bully from ""A Christmas Story"") whenever I hear the wolf's theme.<U+FEFF>"
"1002","Prokofiev","Them: bangs loud drum
Conductor: now if you're all relaxed<U+FEFF>"
"1003","Prokofiev","I had this music stuck in my head for decades before learning what it was. I first head it when I was four and it has been stuck in my head since.<U+FEFF>"
"1004","Prokofiev","This performance is utterly amazing. The conductor's narration is delightful, and the instruments evoke the story better than almost any performance I've heard before.<U+FEFF>"
"1005","Prokofiev","What's with the flautist's hair <U+00A0>at 3:40 ? It's up in that shot, then down in the next, then up in last.<U+00A0><U+FEFF>"
"1006","Prokofiev","I actually got goosebumps from some scenes.<U+FEFF>"
"1007","Prokofiev","Ms. Christie Reside, you make the loveliest bird!<U+FEFF>"
"1008","Prokofiev","I only heard this once at school in the 70's in England. I have never forgotten it. Wonderful. I will show this my grandchildren. Two of them have just started to learn the tenor horn and trumpet at school. I am so proud of them. I would have loved to had the chance to learn to play an instrument, but sadly I never that chance. They do. Thank you for this lovely post. x<U+FEFF>"
"1009","Prokofiev","This was weirdly awesome.<U+FEFF>"
"1010","Prokofiev","""A Christmas Story"" had the French horns part when Scott Farkus came in! Lol<U+FEFF>"
"1011","Prokofiev","Ugly.. Smelly... Why?! I'm a french horn player!!!!!!<U+0001F62D> but it is pretty smelly.<U+FEFF>"
"1012","Prokofiev","3:46 what the hell is up with the flautists hair? Up or down make your mind up<U+00A0>
:P<U+FEFF>"
"1013","Prokofiev","Fantastic!! The orchestra sounds exactly like the one I know from the cassette I used to listen to when I was young. I LOVED it, such a lovely musical story for children in any country, no matter which language they speak. Cause music is the universal language everybody understands... :)<U+FEFF>"
"1014","Prokofiev","Delightful! Well executed and extremely funny narration, capturing the essence of the piece.<U+FEFF>"
"1015","Prokofiev","many music. so orchestra. such andante con brio<U+FEFF>"
"1016","Prokofiev","Used this for my homework.<U+FEFF>"
"1017","Prokofiev","I heard this song on one of the Simpsons episodes when santas little helper is wandering around the country, and man i went crazy not knowing what this song was called, not even the Shazam app couldnt tell me (which is really depressing to know) but anywhoo im glad i found it and of course my favorite part of the this piece is Peters Theme :D<U+FEFF>"
"1018","Prokofiev","Every time I hear the wolf portion all I can think of is Scott Farkas from a Christmas Story<U+FEFF>"
"1019","Prokofiev","conductor's narrating and conducting is so funny and exciting looooool<U+FEFF>"
"1020","Prokofiev","In Russia, a wolf does not catch you, but you catch the wolf...<U+FEFF>"
"1021","Prokofiev","the conductor is as delightful as Prokoviev himself!<U+FEFF>"
"1022","Prokofiev","FROM A REDDIT POST I SEEN IN A DOODLE DANK MEME VIDEO

Edit: meant dank doodle meme<U+FEFF>"
"1023","Prokofiev","This is a really great rendition! Got to love it!<U+FEFF>"
"1024","Prokofiev","How great is it to share this with kids, I remember laying on the floor of our lounge room and listening to this way too loud and just thinking it was the best thing ever!! A must for kids !!! please send the grumpy old people home<U+FEFF>"
"1025","Prokofiev","The music is outstanding and I loved the narration<U+FEFF>"
"1026","Prokofiev","Oh dear. I don't think I've ever heard the whole piece and the whole story. We didn't have it at home and I'm apparently exactly the generation at which Czech teachers decided to drop Russian music from the curriculum or something (my sister has heard it at school, I haven't - at least not the whole thing and not until much later). This was such a fun performance, thank you for sharing.<U+FEFF>"
"1027","Prokofiev","Who on earth takes a baby to an orchestra?<U+FEFF>"
"1028","Prokofiev","finally some action for the timpani<U+FEFF>"
"1029","Prokofiev","This makes me really want to pick up my Clarinet again.
Oh how I miss the joys of playing in band. 
<U+FEFF>"
"1030","Prokofiev","I loved this.It made me reminisce about my primary school days & makes me appreciate the school that I attended even more<U+FEFF>"
"1031","Prokofiev","I wish he was my grandpa<U+FEFF>"
"1032","Prokofiev","Y’all came for 1:33 right?<U+FEFF>"
"1033","Prokofiev","This is an excellent performance and recording, and it is fun to watch. I cannot recall when I first started listening to this Prokofiev. This live performance also looks like a rare opportunity for parents to enjoy a bit of culture with their children in a welcome setting. A sort of rare opportunity for children to get some social training under supervision.<U+FEFF>"
"1034","Prokofiev","yep guys okay reddit brought us here now lets talk about THE SONG PLEASE THANK<U+FEFF>"
"1035","Prokofiev","Love this. It brings back happy memories of my childhood, and first ever LP at about age 10yrs. Now aged cough years :) .<U+FEFF>"
"1036","Prokofiev","I just re-lived my childhood... <U+00A0>Loved it!!<U+FEFF>"
"1037","Prokofiev","Good story and wonderful Music.
Awesome video.
the Conduct as the Narrate was so Epic.
i like it.<U+FEFF>"
"1038","Prokofiev","THIS IS A TRUE STORY.<U+FEFF>"
"1039","Prokofiev","Is it just me or do each artist look kinda like the animal they're portraying?<U+FEFF>"
"1040","Prokofiev","I remebered when I listened in this orchestra and the story since 5th grade when I working in subjects<U+FEFF>"
"1041","Prokofiev","Who else has to listen to this at school?<U+FEFF>"
"1042","Prokofiev","Wow, takes me back to my childhood.Thank you for uploading this.<U+FEFF>"
"1043","Prokofiev","Bramwell Tovey - he should release a recording of famous children's stories. I'd listen to it even if my kids didn't!<U+FEFF>"
"1044","Prokofiev","childhood classic, got my newborn listening and he loves it!!!<U+FEFF>"
"1045","Prokofiev","I do hope you're satisfied with our product.<U+FEFF>"
"1046","Prokofiev","I love the Scottish accent when Bramwell Toby does the voice of Grandfather. Perfect.<U+FEFF>"
"1047","Prokofiev","I hear bits of Jaws, Nazi theme from Raiders, hints of Star Wars as well. :) <U+FEFF>"
"1048","Prokofiev","1:38 Blade Runner!!<U+FEFF>"
"1049","Prokofiev","Great I play bassoon so this is one reason I picked up this instrument Thank you for the great music<U+FEFF>"
"1050","Prokofiev","Scottish gramps is quite the doozy.<U+FEFF>"
"1051","Prokofiev","Here from DDM? Just me?<U+FEFF>"
"1052","Prokofiev","This is just wonderful!<U+00A0> I am sharing to Facebook for my grandchildren and friends to enjoy!<U+00A0> Thank you so very much for this musical gift!<U+FEFF>"
"1053","Prokofiev","I remember seeing a puppet play of this with a full orchestra when I was younger and have loved peter and wolf since<U+2764><U+2764><U+FEFF>"
"1054","Prokofiev","Thank you!Remember at school we listened and enjoyed long ago :)<U+FEFF>"
"1055","Prokofiev","I have had the great fortune to be conducted by Maestro Tovey on several occasions, and he is one of the most genuinely inspiring people I've ever met! So lovely to see this performance :)<U+FEFF>"
"1056","Prokofiev","Is someone else pissed about the kid crying in the background? Like wtf is the same as in the movie theaters, DONT TAKE CHILDREN IF THEY CANT UNDERSTAND THE THING THEY ARE WATCHING/HEARING AND JUST START CRYING<U+FEFF>"
"1057","Prokofiev","Anyone else from INigga<U+FEFF>"
"1058","Prokofiev","I love how much the music tells the story!!!<U+FEFF>"
"1059","Prokofiev","we watch their s in class today<U+FEFF>"
"1060","Prokofiev","Prokofiev -Pedro e o Lobo, ouco a 30 anos, mas cada vez que ouco sinto como se fosse a primeira vez.<U+FEFF>"
"1061","Prokofiev","Fantasic - Prokofiev would have been proud.<U+FEFF>"
"1062","Prokofiev","Am I the only person who thinks the conductor sounds like Malcolm McDowell? Also, I came here after watching Blade Runner 2049. I haven't heard this composition anywhere in ages.<U+FEFF>"
"1063","Prokofiev","I came here off of a dank doodle meme<U+FEFF>"
"1064","Prokofiev","I'm here because of Blade Runner 2049<U+FEFF>"
"1065","Prokofiev","Love this...reminds me of being in elementary school and doing the same performance and I was Peter :)<U+FEFF>"
"1066","Prokofiev","1:38
yeah, that's it<U+FEFF>"
"1067","Prokofiev","I played the cat in our local theater production of Peter and the Wolf...so blessed...14 years old, best summer of my life...I auditioned did not get the part, but my older sister got the part of a male Russian hunter (she did it all for me)...she talked them into letting me be understudy of Alexis the Cat...well if the actress who was Alexis a college theatre major didn't drop out shortly thereafter...the part was mine. Had big shoes to fill. Omg. I Loved it. It really brought me out of my shell. The music is so haunting and beautiful. Still fascinated. Play it for me please.<U+FEFF>"
"1068","Prokofiev","2:28

Once upon a time....<U+FEFF>"
"1069","Prokofiev","(voice breaking) and with one (makes sad gulping noise)<U+FEFF>"
"1070","Prokofiev","Who came here from dank doodle memes<U+FEFF>"
"1071","Prokofiev","I had been lesrning Playlists and i have watched this in class<U+FEFF>"
"1072","Prokofiev","Thank you Sweet Jesus that Bram is gone. The worst conductor the VSO has ever had. It may be impossible to undo the damage and restore this once...serviceable, and dedicated ensemble.  At least cut the Star Wars/Broadway shit out.<U+FEFF>"
"1073","Prokofiev","BRAMWELL TOVEY is an absolute legend! I was lucky enough to see him conduct/narrate in the Sydney Opera House. A true genius. His narration was spellbinding!<U+FEFF>"
"1074","Prokofiev","were can I buy a copy of this for my Grandkids<U+FEFF>"
"1075","Prokofiev","I like the end--
the duck, accelerando, faster, faster, faster, faster, then-- ""whaaa"".<U+FEFF>"
"1076","Prokofiev","I'm doing a play and I'm WOLF<U+FEFF>"
"1077","Prokofiev","How could anybody dislike such a beautiful masterpiece?<U+FEFF>"
"1078","Prokofiev","The duck kills himself basicly<U+FEFF>"
"1079","Prokofiev","Great, I love it. Once upon a time in elementary shcool my music teacher some times narrated the music as well, I loved to listen to her...<U+FEFF>"
"1080","Prokofiev","1:33  Joi is also represented by the orchestra!!!<U+FEFF>"
"1081","Prokofiev","Tovey's narration is awesome.<U+FEFF>"
"1082","Prokofiev","Lol my mum told me to google this!<U+FEFF>"
"1083","Prokofiev","i love this i use to liston to this in school<U+FEFF>"
"1084","Prokofiev","love it!!! narration is good too!<U+FEFF>"
"1085","Prokofiev","I don't know why I'm always driven to tears by ""Peter and the Wolf"". It is a simple and innocent story. I just can't hold my emotions in when I hear the interactions between the different characters (instruments). My favorite part is that the music tells you who, what, when, where and even how, a scene plays out. The narration is fantastic, but even without it, the choice of instrument, the tempo, intensity and mood of the music is enough to paint the picture in its entirety.<U+FEFF>"
"1086","Prokofiev","I remember going to this symphony when I was 12 years old in 1972 in Vancouver.
Same dialogue, music stimulates your imagination. Smelly french horns and crying kids. Better than rap and whatever the younger generation call it. Close your eyes and open your imagination Hayley.<U+FEFF>"
"1087","Prokofiev","Wolf part = best part<U+FEFF>"
"1088","Prokofiev","Yooo I remember hearing this is music class I loved it so much<U+FEFF>"
"1089","Prokofiev","He’s being a bit racist to the French. Why r the French horns smelly and horrible? HUH?!<U+FEFF>"
"1090","Prokofiev","I loved the director in his double roll. Just perfect, all of them :.-)<U+FEFF>"
"1091","Prokofiev","Santas little helper brought me here..for years I wondered what piece this was finally found it...love it<U+FEFF>"
"1092","Prokofiev","I love peter and the  wolf<U+FEFF>"
"1093","Prokofiev","aha<U+0001F602> My music teacher would make us Listen to this back on elementary school<U+FEFF>"
"1094","Prokofiev","Oh gosh so much nostalgia from grade 3 when my music teacher used to pull out that bulky ass tv 
Now I’m in grade 9 and I’ve been playing the flute for 4 years <U+0001F62D><U+0001F62D><U+0001F62D><U+FEFF>"
"1095","Prokofiev","Joi from Blade Runner 2049<U+FEFF>"
"1096","Prokofiev","coool YOu are amazzingg<U+FEFF>"
"1097","Prokofiev","Marvellous! The kid in the audience ruins it totally, I think...<U+FEFF>"
"1098","Prokofiev","Ahh I love this. Used to go the symphony from 1st thru 3rd grade to see this with a live cartoonist on a projector.<U+FEFF>"
"1099","Prokofiev","I funny gang where you at ?<U+FEFF>"
"1100","Prokofiev","I heard this (or a very similar piece) when I was very young, early 60's. Love it.<U+FEFF>"
"1101","Prokofiev","He also came he from dank doodle memes<U+FEFF>"
"1102","Prokofiev","Its beautiful work by you and ur team of musicians and i enjoyed it so much thank you<U+FEFF>"
"1103","Prokofiev","8:22 is a big jump scare on full volume<U+FEFF>"
"1104","Prokofiev","Thank you for posting this. I enjoyed it so much!!<U+FEFF>"
"1105","Prokofiev","I had to watch this for a piano assignment but its rlllllyyyyyyyyyyyy good!!!!<U+FEFF>"
"1106","Prokofiev","damn. that lady is ROCKING that bassoon.
this is super cool.<U+FEFF>"
"1107","Prokofiev","THE SIMPSONS : DOG OF DEATH EPISODE OMG 
finally i find this master pieceeee<U+FEFF>"
"1108","Prokofiev","excellent piece!<U+FEFF>"
"1109","Prokofiev","This performance would be so much better without a yelling child in the background.<U+FEFF>"
"1110","Prokofiev","Amazing!<U+FEFF>"
"1111","Prokofiev","This is absolutely amazing, so so beautiful side by side with the story<U+FEFF>"
"1112","Prokofiev","My childhood in a nutshell... beautiful version!! Thank you.<U+FEFF>"
"1113","Prokofiev","the best way to tell a story<U+FEFF>"
"1114","Prokofiev","I remember watching this in the cafeteria on a pull down screen, then remember it in AP high school humanities class to name classical music for extra credit...still love it.<U+FEFF>"
"1115","Prokofiev","My Dad gave me this 33rpm record when I was a kid, great memorys, thanks Dad<U+FEFF>"
"1116","Prokofiev","the strings made me cry<U+FEFF>"
"1117","Prokofiev","The conductor is an absolute boss!! <U+0001F60E><U+FEFF>"
"1118","Prokofiev","It was very interesting<U+FEFF>"
"1119","Prokofiev","Splendid, delightful ... sharing with family, especially children.<U+FEFF>"
"1120","Prokofiev","i love this :)<U+FEFF>"
"1121","Prokofiev","oboes are bomb<U+FEFF>"
"1122","Prokofiev","This traumatized me as a child XD<U+FEFF>"
