"","Composer","Text"
"720","Stravinsky","For my ears and feel one of the most beautiful works ever been written!!! Great interpretion here with an extraordinary orchestra and a brilliant conductor and that in a wonderful recording! 
I have some old vinyls with this ensemble and Neville Marriner and they all are excellent.
Btw: I looove great orchestras like here (six basses and all that...) because of the sheer loudness, energy and power..
Just to mention it: Love the ladies with the flutes.
Thank you for that time of pure bliss!!!
Regards from Berlin
A happy listener<U+FEFF>"
"721","Stravinsky","STRAVINSKY GEHORT ZU DEN GANZ GROSSEN AUSSERIRDISCH-INNERerDISCHEN KOMPONISTEN: Gratuliere zu dieser Interpretation: Ich klatsche ganz laut mit.<U+FEFF>"
"722","Stravinsky","une tres belle oeuvre de stravinsky<U+00A0><U+FEFF>"
"723","Stravinsky","23:00 is such a brilliant pure childish part with that naive melody fully embraced by the orchestra and those echoes on the horns rising up and down at a distance. Gives me the chills everytime.<U+FEFF>"
"724","Stravinsky","envahi par l'emotion , 0:53, Andris Nelson perd le file de la musique... juste magnifique.. on est loin de la version conduit par ce fumiste de Pierrre Boulet ! Magnifique... juste MAGNIFIQUE<U+FEFF>"
"725","Stravinsky","Toute ma musique est fondee et comprise dans ces trente-cinq minutes.<U+FEFF>"
"726","Stravinsky","Petruska, hermosa sinfonia que evoca los juegos de la infancia y todos los personajes y heroes nacidos de la imaginacion.Se intuyen balancines y columpios ,carruseles etc. Muy hermoso todo.<U+FEFF>"
"727","Stravinsky","00:52 and 03:40 <3<3<3<U+FEFF>"
"728","Stravinsky","Stravinsky, master of color, realized by a great ensemble.<U+FEFF>"
"729","Stravinsky","I didn't know Jack Nicholson was such a good conductor<U+FEFF>"
"730","Stravinsky","Tututute tututute tututute tututute tututututututute... Voila, je sais joue de la trompette maintenant<U+0001F44D><U+FEFF>"
"731","Stravinsky","While I still do not quite understand Stravinsky on some of his pieces, I still find it enjoyable. Also the conductor looks like he would not be a challenge to follow accurately.<U+FEFF>"
"732","Stravinsky","6:59 - Diatonic
10:00 - Clarinets (volume up)
13:37 - Piano
20:03 - Strings<U+FEFF>"
"733","Stravinsky","..Love how their brass players are such Artists !!<U+FEFF>"
"734","Stravinsky","jo no son music pero Stravinsky sempre m'ha fascinat.<U+FEFF>"
"735","Stravinsky","If you don't get THE CHILLS at 0:53... Stop watching and plan your funeral.<U+FEFF>"
"736","Stravinsky","OH MY.. This is now my favorite  ever!! TEARS . Bernstein was always my fav ,move over Lenny...RIP<U+FEFF>"
"737","Stravinsky","thank you for the post.  Nelsons is one of my favorite conductors and since I first heard them with Haitink in the 1980s I always thought he Concertgebouw is the beat orchestra.  Happy that Gramophone's panel of critics chose it as the best so i knew i wasn't imagining this.<U+FEFF>"
"738","Stravinsky","Magnifique    Ah Quel Grand Compo<U+FEFF>"
"739","Stravinsky","Wonderful performance and great conductor!<U+FEFF>"
"740","Stravinsky","GREAT MUSIC<U+FEFF>"
"741","Stravinsky","Wonderful performance. Thank you for your dedication and devotion to Art.<U+FEFF>"
"742","Stravinsky","wonderful performance!!!!<U+FEFF>"
"743","Stravinsky","Great piece!  Great performance--perfect tempi!<U+FEFF>"
"744","Stravinsky","27:10 headbanging begins<U+FEFF>"
"745","Stravinsky","Stunning performance, amazing acoustics, charismatic conductor. You couldn't ask for more.<U+FEFF>"
"746","Stravinsky","Who is the 1st trumpet?<U+FEFF>"
"747","Stravinsky","wow.<U+00A0> pure music.<U+00A0> fantastico.<U+00A0> every note was nuanced.<U+00A0> I heard sounds and textures I haven't heard before.<U+00A0> great job.<U+00A0> couldn't have been better.<U+00A0> perfecto.<U+00A0> thank you!!!!!!<U+FEFF>"
"748","Stravinsky","Those who've played the piano transcription know this is an insane tempo to ask the pianist to keep up with @ 8:57. Sure enough he falls slightly behind at 9:02.<U+FEFF>"
"749","Stravinsky","7:00<U+FEFF>"
"750","Stravinsky","This piece has the best orchestration ever?<U+FEFF>"
"751","Stravinsky","Why is the conductor happy to conduct Stravinsky (It's so damn hard to do so)? Also, why do flautists like move so damn much! Just kidding; love Stravinsky, the orchestra, and the conductor.<U+FEFF>"
"752","Stravinsky","Fantastic<U+FEFF>"
"753","Stravinsky","GLORIOUS performance!!!!!!!!<U+FEFF>"
"754","Stravinsky","I was 7, this was my first ballet! I'd forgotten how beautiful it is...<U+FEFF>"
"755","Stravinsky","i love the composer, hes so happy!<U+FEFF>"
"756","Stravinsky","Love Stravinsky, and this performance is marvelous!<U+FEFF>"
"757","Stravinsky","OMG hahaha I didn't see his collar for a while and I thought he was wearing a sweatshirt, sweating his ass off and jumping while being way too much into it. It was just too much for me xD

Great music though!<U+FEFF>"
"758","Stravinsky","Me gusta  mucho esta melodia una gran orquesta<U+FEFF>"
"759","Stravinsky","Everytime I listen to this I always hear a wind instrument overblow(?) at 4:03 lol I can't unhear it<U+FEFF>"
"760","Stravinsky","Can’t imagine how phenomenal this would be live. Listening via YouTube gave me enough shivers and smiles.<U+FEFF>"
"761","Stravinsky","who's the trumpet player?<U+FEFF>"
"762","Stravinsky","The first part of this symphony is one of the gladdest pieces of music I have ever heard<U+FEFF>"
"763","Stravinsky","B E A U T I F U L.....Excellent Orchestra....so symphatetic conductor!<U+FEFF>"
"764","Stravinsky","Vim aqui pelo grande Ariano Suassuna!!!<U+FEFF>"
"765","Stravinsky","You deserve my like!<U+FEFF>"
"766","Stravinsky","Needed another Microphone in the woodwind, bassoon , Coranglais...one less in the trumpet section. A great enthused performance.<U+FEFF>"
"767","Stravinsky","Piccolo player at 1:36, ""hmm this thing is small""<U+FEFF>"
"768","Stravinsky","The music is incredible, transporting, and magical all at the same time.<U+FEFF>"
"769","Stravinsky","Stravinsky was a true master!!<U+FEFF>"
"770","Stravinsky","This is so nice,that i can enjoy it even without the sound!!! peace and love<U+FEFF>"
"771","Stravinsky","Bookmark: Flute cadenza at 5:43<U+FEFF>"
"772","Stravinsky","Russian composers on rhe XX century flew higher than any others: no doubt! Yet the very best far from Stravinsky and Shostakovich was Rachmaninov. Here however is a very exquisite piece of Igor as well as The Firebird.
Nice performance too.<U+FEFF>"
"773","Stravinsky","Wonderful performance of the masterpiece by Stravinsky.... I 've got chills and bumps all over... why ? Go figure. Thank you so much Avrotros and Youtube. You are the sunshine of our lives !!!!!!!<U+FEFF>"
"774","Stravinsky","Have to watch the ballet after listening to this poerful music - breathtaking !<U+FEFF>"
"775","Stravinsky","This is the fastest recording of petrushka I’ve ever heard<U+FEFF>"
"776","Stravinsky","Comment Yee On Another Video
#Yee<U+FEFF>"
"777","Stravinsky","I've got to admit, this is a very unique piece.<U+FEFF>"
"778","Stravinsky","0:10 - 0:14 when u have 500 ping<U+FEFF>"
"779","Stravinsky","Oh, My GOD ! Fantastic performance !<U+FEFF>"
"780","Stravinsky","What's the name of the conductor? He's is such amazing!<U+FEFF>"
"781","Stravinsky","I love this piece so much!<U+FEFF>"
"782","Stravinsky","OMG OMG OMG OMG OMG how wonderful OMG OMG!!!!!!<U+FEFF>"
"783","Stravinsky","Very lively and at the same time precise performance of this challenging masterpiece. The orchestra is without doubt one of the five best<U+00A0>in Europe.<U+FEFF>"
"784","Stravinsky","I find the Russian composers far more appealing than the classical European composers.  I find Stravinsky mesmerizing.<U+FEFF>"
"785","Stravinsky","Love this interpretation, but that Flute Player is having a seizure!<U+FEFF>"
"786","Stravinsky","Entendo nada de musica classica. Mas achei a sonoridade e evolucao da musica imprevisivel e variada. Nao fica morgado. Mas a quebra de ritmo talvez n seja tao boa. De td forma se compensa pela variacao. Lembra desenhos animados.<U+FEFF>"
"787","Stravinsky","Who is the pianist?<U+FEFF>"
"788","Stravinsky","wow! what a awesome!!! it's really~!~!<U+FEFF>"
"789","Stravinsky","My classmates and teacher love petrouchka<U+FEFF>"
"790","Stravinsky","first four bars = looking down four times. Every bar. Funny?<U+FEFF>"
"791","Stravinsky","7:00 good part<U+FEFF>"
"792","Stravinsky","the contra bassoon at 5:15 and 5:23 gets me laughing every time hahaha <U+FEFF>"
"793","Stravinsky","Wie viele der Orchestermitglieder sind, Ihrer Meinung nach, niederlandisch? :)<U+FEFF>"
"794","Stravinsky","That is really interesting! I had no idea!! thanx for the info :). And this does sound beautiful! a little intimidating for me because I will be performing this with an orchestra in the 26th of October. Scary yet exciting<U+FEFF>"
"795","Stravinsky","Yes man, Ton Koopman is happier than him.<U+FEFF>"
"796","Stravinsky","Here's Johnny!
<U+FEFF>"
"797","Stravinsky","Very lively performance - bravo!<U+FEFF>"
"798","Stravinsky","Interesanti, ka telev<U+012B>zij<U+0101> r<U+0101>da diri<U+0123>enta seju it k<U+0101> t<U+0101> ko saka publikai. Kaut ar<U+012B> j<U+0101>, tiem kas neskat<U+0101>s uz rok<U+0101>m, tas var<U+0113>tu b<U+016B>t vien<U+012B>gais veids k<U+0101> saprast kas m<U+016B>zik<U+0101> notiek....<U+FEFF>"
"799","Stravinsky","The conductor is Latvian, madam...and the main conductor is also Latvian.<U+FEFF>"
"800","Stravinsky","A Dutch Orchestra/Conductor :) 
Fair play to them :)<U+FEFF>"
"801","Stravinsky","This so good :)  !<U+FEFF>"
"802","Stravinsky","Sehr lebhafte und zugleich prazise Auffuhrung dieses anspruchsvollen Meisterwerkes. Das Orchester ist zweifellos eines der funf besten Europas.<U+FEFF>"
"803","Stravinsky","Conductor looks like a chubby Michael Sheen.
Love this piece.<U+FEFF>"
"804","Stravinsky","This guy's gonna be the new bso conductor!!!<U+FEFF>"
"805","Stravinsky","I agree. For someone who has heard other interpretations this is abit lukewarm. NOT BAD, but it doesn't have that electric pulse that is so...STRAVINSKIAN. I first heard this (as a kid) from a CBS recording with Stravinsky himself conducting. But I wouldn't call it sloppy. Peace:)<U+FEFF>"
"806","Stravinsky","This is an exuberantly joyful piece!!  It's about puppets/dolls that came alive! :)<U+FEFF>"
"807","Stravinsky","Sloppy playing or sloppy conducting? Compared to Boulez and Cleveland this is a disaster indeed....<U+FEFF>"
"808","Stravinsky","I am glad you and others like it. Being in minority does not mean I am wrong.<U+FEFF>"
"809","Stravinsky","I and an overwhelming majority of viewers like it very much.<U+FEFF>"
"810","Stravinsky","HELL YES this guy's the next BSO music director!<U+FEFF>"
"811","Stravinsky","Conductor hardly looks up from score. Orchestra hardly looks at conductor.... Quite an uninteresting performance....<U+FEFF>"
"812","Stravinsky","bravo!<U+FEFF>"
"813","Stravinsky","Tony from South Philadelphia thinks this version is just AWSOME!!!! Go PO!!
<U+FEFF>"
"814","Stravinsky","Just thinking that myself. I guess it'll have to be a duel?<U+FEFF>"
"815","Stravinsky","The best batch yet<U+FEFF>"
"816","Stravinsky","American?<U+FEFF>"
"817","Stravinsky","Great. Everyone's feeding off the conductor's - and each other's energy.<U+FEFF>"
"818","Stravinsky","Nice job concertmaster, but you still killed Dumbledore.<U+FEFF>"
"819","Stravinsky",":) great
<U+FEFF>"
"820","Stravinsky","Petrouchka and the Psalmns are my favorite Stravinsky's pieces - the Intro of the music  has fantastic rhythmic/harmonic cells (or dare I say motivs). Superb recording here<U+FEFF>"
"821","Stravinsky","Not my favorite Stravinsky work, but definitely the weirdest and out of the blues one. It has its good parts.<U+FEFF>"
"822","Stravinsky","I wouldn't mind taking the second flutist out to dinner!<U+FEFF>"
"823","Stravinsky","You are Right, Just now watched his performance of  Also Sparch Zarasthustra<U+FEFF>"
"824","Stravinsky","You Mean Gustavo Dudamel<U+FEFF>"
"825","Stravinsky","Sure the orkester /conductor ..contributes to the vivid performance but dont you think the great music is to ""blame"" ? As for the ""dead'"" - avoid and listen to the Venecual's Youth orkestra even when not conducted by Dada ..(Sorry I dont remember the name)<U+FEFF>"
"826","Stravinsky","How do you know he's American?<U+FEFF>"
"827","Stravinsky","Giuliano Sommerhalder! He will be at the Vienna Philharmonic one time, I promise.<U+FEFF>"
"828","Stravinsky","this is less psychotic than the piano version
<U+FEFF>"
"829","Stravinsky","Bartok used tritones heavily as well, the Miraculous Mandarin is awash in them, as is the Shrovetide Fair.  And both Bartok and Stravinsky utilized folk melodies, Roumanian/Magya and Russian respectively.  The use of simple melodies (themes) with polytonality and constantly changing rhythms make the music of both composers special.  The interpretation here is one of the best I've heard.  Bartok's Divertimento for Strings is tritonalism in overdrive.<U+FEFF>"
"830","Stravinsky","Nice rendition !
Thanks<U+FEFF>"
"831","Stravinsky","You can still be happy even though you don't smile.. A smile just shows that you have energy and time to show your happiness to others!<U+FEFF>"
"832","Stravinsky",":O
<U+FEFF>"
"833","Stravinsky","i need to explore this further--thank you.<U+FEFF>"
"834","Stravinsky","I get the feeling the conductor wasn't too familiar with the score as he had to look down at his score quite often, more than typical.  Nonetheless, I like his interpretation.  <U+FEFF>"
"835","Stravinsky","Yes.  And Tritones also.  The prominence of the tritone interval is prevalent, both melodically and harmonically. This interval is a common one separating melodies of a bitonal nature (Polytonality), and Stravinsky frequently used scales that contain tritones as source material for his melodies.  Stravisnky was THE 20th century's musical genius.  <U+FEFF>"
"836","Stravinsky","If you think these guys move when they play check out the Berlin Phil! They gave the rest of the orchestral world permission.<U+FEFF>"
"837","Stravinsky","Bloody hell!! Listen to this beatiful music and stop complaning about video registration!! One of the most perfect interpretations for me. Macnifficant!! And don't you see in the mirror every day again. Alway's the same..... Francisco. <U+FEFF>"
"838","Stravinsky","One of the best recordings and performances I've heard of Petrushka, absolutely beautiful... Hail Stravinsky!!!<U+FEFF>"
"839","Stravinsky","of course, in fact look up in wikipedia about the Petrushka chord :D<U+FEFF>"
"840","Stravinsky","I was talking about the one at @17:07 but that one too sounds great<U+FEFF>"
"841","Stravinsky","18:20?<U+FEFF>"
"842","Stravinsky","impresionante<U+FEFF>"
"843","Stravinsky","this is pretty sloppy<U+FEFF>"
"844","Stravinsky","Not a good video production. Cameras focus on same flute, clarinets and trumpets constantly. They forget the piano, celesta, the harps, percussion and other important soloists. Never saw the cornets either.  But sound is excellent.

<U+FEFF>"
"845","Stravinsky","are parts of this bi-tonal?  Stravinsky such a genius--voted top composer of the 20th century by Time!<U+FEFF>"
"846","Stravinsky","yes, but this guy is low key compared to 'Mr. Hair and Arms Swinging""--Dudemel--now THAT guy really is irritating.  <U+FEFF>"
"847","Stravinsky","nearly as atrocious as Nezet-Seguin and Alsop, might I add<U+FEFF>"
"848","Stravinsky","a face nicely buried in the score. well done to the conductor.<U+FEFF>"
"849","Stravinsky","Great conductors don't need to have a score in front of them, this score is easy to memorise.<U+FEFF>"
"850","Stravinsky","Concertgebouw, Amsterdam...<U+FEFF>"
"851","Stravinsky","Wie heißt die Soloflotistin?<U+FEFF>"
"852","Stravinsky","The pianist is excellent.<U+FEFF>"
"853","Stravinsky","I concur with rdnz123. i have the full score in front of me- The decending bass figure in question is heard 3 times over a 9 second period. At 7.43 it ends on a low 'e'. The second time, at 7.48 it ends a semitone higher on an 'f'.Then the final time, at 7.52 it ends on an 'e' again.<U+FEFF>"
"854","Stravinsky","How do you know he's American?<U+FEFF>"
"855","Stravinsky","flawless trumpet solo!!<U+FEFF>"
"856","Stravinsky","I would think that it is safe to say that the podium is this man's favorite place on earth :)<U+FEFF>"
"857","Stravinsky","19:57<U+FEFF>"
"858","Stravinsky","13:37<U+FEFF>"
"859","Stravinsky","10:47<U+FEFF>"
"860","Stravinsky","But the piano is a half step off of the bass note at 7:47<U+FEFF>"
"861","Stravinsky","I'm fairly sure that's the contrabassoon playing the correct part...<U+FEFF>"
"862","Stravinsky","It would seem to be 1947 with fewer woodwind etc.<U+FEFF>"
"863","Stravinsky","The Amsterdam Concertgebouw - has arguably the world's best acoustics.<U+FEFF>"
"864","Stravinsky","Tremendous ! I wonder how Stokowski would think about it... I'd spend my whole time watching this conductor ! And Gustavo Nunez..., I'm in love with his bassoon yummy<U+FEFF>"
"865","Stravinsky","Excellent rendiction !
Thanks a lot<U+FEFF>"
"866","Stravinsky","Wonderful!  Leaves nothing to be desired, but I'm curious on one point:  Is this the 1911 version or the 1947, which is slightly re-orchestrated for a marginally smaller group?<U+FEFF>"
"867","Stravinsky","What hall is this? Great performance!!!<U+FEFF>"
"868","Stravinsky","Splendide ! la reputation du Concertgebouw n'est pas a refaire; des musiciens au top ! BRAVO !<U+FEFF>"
"869","Stravinsky","The second trumpet looks like Gordon Ramsay.<U+FEFF>"
"870","Stravinsky","I wish they could have found a way to show the pianist better.  Some shots of his hands would have been nice<U+FEFF>"
"871","Stravinsky","Yes!  Love it!!!!<U+FEFF>"
"872","Stravinsky","I notice that the players in this orchestra move when they play, especially the winds.  It's really nice to see.  It's natural movement too. <U+FEFF>"
"873","Stravinsky","What a lively, engaging, HAPPY performance! This is going on my ""favorites""listing permanently!  So many orchestral performances these days are so dead and tired.  Not this one.<U+FEFF>"
"874","Stravinsky","Great performance, terrible camera work. Did no one alert the director that whole sections of this work are in effect a concerto for piano and orchestra? Now and then, it'd be nice to see the pianist's fingers. I've played that part and it's NOT even remotely easy!<U+FEFF>"
"875","Stravinsky","eating my piccolo at 32:22<U+FEFF>"
"876","Stravinsky","GOSTEI MUITO DESTAS 2 PECAS DE STRAVINSKY; ALIAS  GOSTO DE TUDO QUE FOI COMPOSTO POR STRAVINSKY<U+FEFF>"
"877","Stravinsky","Beautiful !
Thanks<U+FEFF>"
"878","Stravinsky","The music of my difficult childhood. Love it.<U+FEFF>"
"879","Stravinsky","The conductor's enthusiasm is sweet- like a student- like a kid in a candy store. He conducts rather like I used to ' conduct' to recordings on the stereo when I was a teenager; lots of unecessary gestures that communicate his physical response to the music, if nothing else. But even as a teenager I could have lifted my head from the score for more than half a bar at a time. But, yes- what a score! The ear never tires of it. And the the erruption at 28.34? One of the great moments in music!<U+FEFF>"
"880","Stravinsky","Giuliano Sommerhalder.<U+FEFF>"
"881","Stravinsky","Trumpet player very good. sehr gut!
What's trumpet player name?<U+FEFF>"
"882","Stravinsky","This music is over 100 years old, and as fresh as the day it was completed. 
Way to go Maestro Stravinsky! Thanks great and truly animated through performance.<U+FEFF>"
"883","Stravinsky","This guy has a permanent smile--like a porpose!---good we need more happy conductors/people in the world!!!<U+FEFF>"
"884","Stravinsky","Imagine Tom Hanks as the oboist :)<U+FEFF>"
"885","Stravinsky","Great !<U+FEFF>"
"886","Stravinsky","We just need good cartoon<U+FEFF>"
"887","Stravinsky","There was a superior performance of the same orchestra on You Tube a few months ago, but with Maris Jansons. I believed taken from a concert in Japan. Sadly it was removed. Look out for that one! Hopefully someone is going to repost it.<U+FEFF>"
"888","Stravinsky","Quite fun. The conductor keeps his head in the score . .  ?? Maybe, like Bernstein, he wants every performance wants to be one of ""discovery"" -- the conductor 'discovers' the piece anew every time. This [youthful] orchestra seems to respond with vigor and freedom. It would be nice if the editing o the video showed a bit more of his conducting.<U+FEFF>"
"889","Stravinsky","Great first trumpet! Funny conductor ;P<U+FEFF>"
"890","Stravinsky","amazing trumpet slo at 17:09!!!!!!!!!<U+FEFF>"
"891","Stravinsky","thanks for sharing .Stravinsky was a wicked genius<U+FEFF>"
"892","Stravinsky","Crazy stuff!!
Liked it =)<U+FEFF>"
"893","Stravinsky","LOVE THIS MUSIC!<U+FEFF>"
"894","Stravinsky","Stravinsky was the skrillex of classical music.<U+FEFF>"
"895","Stravinsky","Art to express things outside of censorship<U+FEFF>"
"896","Stravinsky","Fantastische  uitvoering door een laaiend enthousiaste dirigent die het beste orkest ter wereld leidt. Stravinksy op zijn allerbest !<U+FEFF>"
"897","Stravinsky","24:40<U+FEFF>"
"898","Stravinsky","This is so beautiful!<U+FEFF>"
"899","Stravinsky","Who's here for an assignment of some sort?<U+FEFF>"
"900","Stravinsky","I just don't get why the beginning of this piece is rarely actually together.<U+FEFF>"
"901","Stravinsky","Whouaou ! la fin on s'y attend pas en vrai<U+FEFF>"
"902","Stravinsky","Thanks for posting!<U+FEFF>"
"903","Stravinsky","It sounds like they didn't drop the tambourine on the floor at 31:28. Lame<U+FEFF>"
"904","Stravinsky","Best European orchestra ...<U+FEFF>"
"905","Stravinsky","Do Caralho !<U+FEFF>"
"906","Stravinsky","Que du bonheur !<U+FEFF>"
"907","Stravinsky","Does anyone know whether this is the original score or the revised?<U+FEFF>"
"908","Stravinsky","Why is it that some cultures don't appreciate the sheer joy of this? Much better than pounding on people to rap.<U+FEFF>"
"909","Stravinsky","igor<U+FEFF>"
"910","Stravinsky","Listening to this is like being stranded on an island thousand miles off GPS and the only stuff alerts you you're on an unprecedented waters are this composition, truly mystery meets adventure, another brilliant russian composer.<U+FEFF>"
"911","Stravinsky","Magnifique !<U+FEFF>"
"912","Stravinsky","Can´t wait to go to<U+00A0>the Concert this evening! I love it!<U+FEFF>"
"913","Stravinsky","Best Symphony Orchestra<U+FEFF>"
"914","Stravinsky","목관 파트  프레이즈가 아주좋다<U+FEFF>"
"915","Stravinsky","he is sad at 8:47 and he gets happy at 8:48<U+FEFF>"
"916","Stravinsky","I adore Stravinsky.  The moment at 25:00 is GLORIOUS..  When the Bear enters and the crowd scatters,  (at 24:39)...I always laugh.  The layering of different tempos at 25:23 always takes my breath away, and is one of my Top 10 favorite moments in all Classical Music.<U+FEFF>"
"917","Stravinsky","A.ネルソンス。彼の今後が、<U+697D>しみです。<U+FEFF>"
"918","Stravinsky","Fun to watch with my music. Makes it clearer<U+FEFF>"
"919","Stravinsky","20:57 Afterwards at the shrovetide fair is my favorite part in the whole ballet, its just so uplifting.<U+FEFF>"
"920","Stravinsky","6:27 sounds like the stink of your favorite doll melting on your baseboard heater, and yet you listen. This scares me. I worry that you listen. You listen. I returd. it, the Tard.<U+FEFF>"
"921","Stravinsky","Brilliant performance, Stravinsky's Petrouchka are spetacular here !<U+FEFF>"
"922","Stravinsky","I love how they moves while playing this piece... THEY'RE ENJOYING STRAVINSKY'S MUSIC DUH!<U+FEFF>"
"923","Stravinsky","The clariet from 24:42 to 25:12 is kind of mesmerizing me.<U+FEFF>"
"924","Stravinsky","I can't tolerate this damn Conductor, another  exhibitionist like Rattle.<U+FEFF>"
"925","Stravinsky","which version is that?<U+FEFF>"
"926","Stravinsky","As always stimulating the musical mind and exciting the physical nerve endings. A treat to experience!<U+00A0> Splendid performance!<U+00A0> Bravo!<U+FEFF>"
"927","Stravinsky","That tuba solo was perfection. I could see dancing bear in my mind!<U+FEFF>"
"928","Stravinsky","amazing<U+FEFF>"
"929","Stravinsky","There was an interview on the radio today with a percussionist about Petrouchka. One of the questions was about its place relative to Firebird and Rite of Spring; the response was that it falls between them. I had been familiar with the Rite of Spring but until now didn't really know about Petrouchka. Happy to have had my attention drawn to it. Thanks for uploading this recording.<U+FEFF>"
"930","Stravinsky","メルヘンチックで、
華麗ですね。バレエと、一<U+7DD2>に聞きたいですね。ネルソンスは、素晴らしい音色を、引き出していますね。とても、リズミカルで、良いですね。流石、世界的に、素晴らしいパフォ<U+30FC>マンスですね。<U+FEFF>"
"931","Stravinsky","The best orchestra in the world performing Stravinsky with a talented young conductor, already famous in Boston and Leipzig.<U+FEFF>"
"932","Stravinsky","The very first time I heard these notes played by horns (28:40 - 29:12) was in the movie ""The Wizard of Oz"" --  I think it is in one of the sequences at the large gate. One of the things that impressed me as a child.<U+FEFF>"
"933","Stravinsky","Anyone know who's playing 1st Horn here?<U+FEFF>"
