"","Composer","Text"
"378","Ravel","In an alternate universe, this would've been a Legend of Zelda concert.<U+FEFF>"
"379","Ravel","люблю Равеля<U+FEFF>"
"380","Ravel","I am disappointed the video ends so abruptly. The ovation I am sure they got is part of the whole experience, I would have love to hear it as well.<U+FEFF>"
"381","Ravel","I love this song and I want  to dedicate  it to my two  horses who died mysteriously  14 days ago, on the same day. Goodbye  my loved  ones,  rest in peace, you will always  be in  my heart.<U+FEFF>"
"382","Ravel","how can you not like that...im vibrating<U+FEFF>"
"383","Ravel","Fun Fact: This was the piece that was supposed to be the overworld theme in the Legend of Zelda on the NES, but due to copyright issues, they weren't able to use it. But I can definitely hear how this amazing piece inspired the theme as well as many of the pieces composed for future Zelda games.<U+FEFF>"
"384","Ravel","The toothpick player was AMAZING!<U+FEFF>"
"385","Ravel","00:00 - 15:49 is the best part.<U+FEFF>"
"386","Ravel","Listened to this song for 8 hrs blindfolded as part of pledging.  It's a great song the first 8x you hear it, but by the 14th time, not so much.<U+FEFF>"
"387","Ravel","Love this music! Thank you youtube!<U+FEFF>"
"388","Ravel","It's very besitiful <U+0001F603><U+0001F603><U+FEFF>"
"389","Ravel","Pity it had to end ,superb<U+FEFF>"
"390","Ravel","best tempo that I ever heard<U+FEFF>"
"391","Ravel","THIS LOVELY  SONG IS DEDICATED TO  ALL HORSE LOVERS. 
THANK YOU SIR  MAURICE  RAVEL FOR SUCH  A BEAUTIFUL SONG.<U+2764><U+FEFF>"
"392","Ravel","La Humanidad se extinguira... pero esto... quedara alli...

Humanity will be extinguished ... but this ... will remain there<U+FEFF>"
"393","Ravel","0:19 Those drumsticks look like they got tatoos!<U+FEFF>"
"394","Ravel","Absolutely A plus  ,It must be his secret toothpick .<U+FEFF>"
"395","Ravel","fyi people when Ravel wrote this everyone said he was ""mad"" repeating the same notes over and over - well  we all know that this one of the best musical pieces ever written and bravo to the Maesto Valery<U+FEFF>"
"396","Ravel","La baguette pour diriger whuaaaaaa tellement petite ils sont tous dedans  Musicalement <U+0001F44F><U+0001F44F><U+0001F44F><U+0001F44F> AVOZINHA ZITINHA.<U+0001F380>

Meeerci beaucoup pour votre video <U+0001F56A><U+0001F50A><U+0001F442><U+FEFF>"
"397","Ravel","somehow, I think Ravel would have liked the toothpick ;)<U+FEFF>"
"398","Ravel","Digimon, Tank you for letting me know this masterpiece!!<U+FEFF>"
"399","Ravel","Surely one of the greatest orchestras in the world ,<U+FEFF>"
"400","Ravel","I cannot have enough of this<U+FEFF>"
"401","Ravel","This is so relaxing<U+FEFF>"
"402","Ravel","The unsung hero; the trumpet who played with the snare drum. He lips must've hurt like hell. (I'm a trumpet player. Also I'm not 100% sure if there was an actual trumpet playing alongside him.) Great song though.<U+FEFF>"
"403","Ravel","I love Boulez’s interpretation more, although Gergiev’s account is fine.<U+FEFF>"
"404","Ravel","absolute masterpiece a hard one to keep sync and done perfectly. Well done.<U+FEFF>"
"405","Ravel","Imagine how autotune would totally wreck this piece.<U+FEFF>"
"406","Ravel","SIMPLY INTOXICATING!!<U+FEFF>"
"407","Ravel","Valery has outdone himself, Bravo!<U+FEFF>"
"408","Ravel","Try the version by Orquesta Joven de la Sinfonica deGalicia - it is an absolute joy to listen to!<U+FEFF>"
"409","Ravel","One word: OUTSTANDING!!!!!<U+FEFF>"
"410","Ravel","тот момент, когда интересно смотреть и слушать))<U+FEFF>"
"411","Ravel","Who will make a new toothpick in world<U+FEFF>"
"412","Ravel","It is incredible to know that there are so many people in this world doing evil things and in the same world there are few doing these beautiful works of art. Bravo !!!<U+FEFF>"
"413","Ravel","I should add it is mesmerizing and I seem to play it over and over!<U+FEFF>"
"414","Ravel","That bassoon solo at 2:03 might be the sexiest sounding one of the bunch<U+FEFF>"
"415","Ravel","Using a toothpick! Not pretentious at all. Now, he IS taking the piss.
TBH, and I do mean it, despite all of my knowledge of this genre, I think the conductor was playing the smallest part in this. I salute the man behind the snare drum<U+FEFF>"
"416","Ravel","SUBLIME <U+0001F442>
JE ME LAISSE TRANSPORTER MUSICALMENTE <U+0001F56A><U+0001F50A>

AVOZIINHA ZITINHA.<U+0001F380><U+FEFF>"
"417","Ravel","Incredible.This is how it's done. Perfection.<U+FEFF>"
"418","Ravel","If you haven't listened to it yet, check out the RadioLab podcast ""Unraveling Bolero"".  There's a tragic beauty underlying this piece that gives it more weight (and makes sense of the repetition).<U+FEFF>"
"419","Ravel","Absolutly Fantastic!!!!<U+FEFF>"
"420","Ravel","Tres, tres belle interpretation.<U+FEFF>"
"421","Ravel","Painstakingly Beautiful performance by the ensemble (Same notes over and over)<U+FEFF>"
"422","Ravel","Is he conducting with a toothpick?<U+FEFF>"
"423","Ravel","One of the BEST performances of Maurice Ravel's Bolero.<U+FEFF>"
"424","Ravel","the drummer didn't just repeat the rhythm for 15 min. he was the other conductor. watch the beat, feel the breathing of the hands, see how the drum lead the piece from whisper to finale.<U+FEFF>"
"425","Ravel","Megorulok erted te n<U+0151>ci imadom a tested es VELED akarok lenni
Olyan izmaim lesznek el<U+0151>bb utobb mint Roccynak a boxgalan.....
MOST akarsz beszelni.,..,.<U+FEFF>"
"426","Ravel","I listen to this music and wattch the video any time I need a little ""lift""!  Love it!!!<U+FEFF>"
"427","Ravel","THAT IS THE BEST I HAVE ""EVER EVER SEEN, GUITAR YOU CAN USE MOST OF THAT TO TRY AND PLAY IT BUT FOLLOW THE TOOTHPICK' LOVE IT EPIC.<U+FEFF>"
"428","Ravel","Болеро просто жесть .... это не музыка - это огонь ...... так все четко и красиво .....<U+FEFF>"
"429","Ravel","what a drummer. crazy static tempo.<U+FEFF>"
"430","Ravel","Composer looks like he’s on sumn<U+0001F480><U+0001F602><U+FEFF>"
"431","Ravel","this is the VERY best version and best photography - mesmerizing and spiritual!!<U+FEFF>"
"432","Ravel","Bravo my boy!<U+FEFF>"
"433","Ravel","Я писал не совсем так, но общий смысл сохранился.<U+FEFF>"
"434","Ravel","It is great music on all time<U+FEFF>"
"435","Ravel","This rendition of this song is spectacular, the conductor has full control of his orchestra, its a beautiful performance !!<U+FEFF>"
"436","Ravel","So beautiful. Every musician is doing his/her best under a great director. Thank you.<U+FEFF>"
"437","Ravel","Incredible!!!<U+FEFF>"
"438","Ravel","Anyone here after watching Miss Hammurabi Ep 4?! <U+0001F605><U+0001F64B><U+0001F3FB><U+200D>♀<U+FE0F><U+FEFF>"
"439","Ravel","this song makes me randy<U+FEFF>"
"440","Ravel","Beautifully played, beautifully conducted, and beautifully filmed.<U+FEFF>"
"441","Ravel","I have seen Valery Gergiev conducting operas (I was lucky) , but this rendition is quite well but not  so good.<U+FEFF>"
"442","Ravel","he is a madman<U+FEFF>"
"443","Ravel","THE CONDUCTOR <U+0001F44F> & THE ORCHESTRA <U+0001F44F> = HAVE ENTERTAINED ME TONIGHT <U+0001F319><U+FEFF>"
"444","Ravel","0:01 | Look very closely. The following expression on the guy's face is not one of anticipation; he's making that face because he knows the conductor fell asleep again. 

XD.<U+FEFF>"
"445","Ravel","Jack Nicholson directing Bolero with a toothpick. Bravo.<U+FEFF>"
"446","Ravel","I did not know Nathan Lane is the concert master of the London Symphony Orchestra.<U+FEFF>"
"447","Ravel","RECORD ENDING, FAR TOO ABRUPT.   ALMOST AS BAD AS COITUS INTERRUPTUS. OTHER WISE , ORGASMIC.<U+FEFF>"
"448","Ravel","I first heard this in Caveman and couldn't find it until I listened to a composition of the greatest classical music and there it was. Amazing song and I never get bored of it. Helps me work, sleep, play, eat, live!<U+FEFF>"
"449","Ravel","Gimmicky with the toothpick but leaping lizards... what's the orchestra?
Oh yes, silly me, the London Symphony Orchestra alla toothpick<U+FEFF>"
"450","Ravel","I searched for ""Bolero perfect version"" and this came up. I'm not complaining.<U+FEFF>"
"451","Ravel","watching a full moon rising with this playing in the background<U+0001F60A><U+0001F64F><U+0001F3FD><U+FEFF>"
"452","Ravel","Gergiev is a composer for the ages! Bravo!<U+FEFF>"
"453","Ravel","and the weak heads, who have the negative gelikt, I wish only good improvement<U+FEFF>"
"454","Ravel","Is this the orchestra that did Rite of Spring. I recognize the bassoonist<U+FEFF>"
"455","Ravel","This dude's facials are hilarious. Ya can tell he's really into it.<U+FEFF>"
"456","Ravel","I love the way each instrument enters the piece,  and getting a little louder until they all join in.  Pure genius.<U+FEFF>"
"457","Ravel","First off, that LOOK he gives to them was like,........LET'S DO THIS!!! It gives me CHILLS up and down your spine and I've always MARVELED at the PRECISION of each and EVERY member of this orchestra!!! No FLAWS, NO MISCUE,.......NOTHING BUT ABSOLUTE ""PERFECTION""!!! It REALLY doesn't get ANY better than THIS here, OMG!!! Also, those DRUMMERS are SIMPLY AMAZING all by themselves!!! BRAVO.....MAGNIFICO!!!<U+0001F44F><U+0001F44F><U+0001F44F><U+0001F64C><U+0001F64C><U+0001F64C><U+0001F44C><U+0001F44D><U+2764><U+FEFF>"
"458","Ravel","ABSOLUTELY EXCELLENT!!!! Wonderful.  The London Symphony Orchestra truly is the best orchestra in the world.<U+FEFF>"
"459","Ravel","masterpiece!!!<U+FEFF>"
"460","Ravel","TOOTHPICK <U+FEFF>"
"461","Ravel","New too classical music just put a tear in my eyes<U+FEFF>"
"462","Ravel","7:03 The Picollo's make the BEST harmony ever to hear! Amazing composition by Ravel!<U+FEFF>"
"463","Ravel","Most increadible drumsticks. They provoked such a ...
And they even don't seem like really moving! :-)
Just great.<U+FEFF>"
"464","Ravel","Drums dude is so talented wth like damn<U+FEFF>"
"465","Ravel","Gergiev, the toothpick conductor <3 :D<U+FEFF>"
"466","Ravel","I was introduced to classical music by bugs bunny.<U+FEFF>"
"467","Ravel","Credit should also goes to the audio and video recording of the performance. All the instruments are coming through clearly and beautifully. I cannot count how many cameras are operating and then edited into a single video file. Good job!!<U+FEFF>"
"468","Ravel","To me this masterpiece consists of the sound of war, orient mystery and adventure.<U+FEFF>"
"469","Ravel","Найс зубочистка.<U+FEFF>"
"470","Ravel","I can't help but thinking of Jayne Torvill and Christopher Dean doing their beautiful dance at the Olympics in 1984.   I see them floating, floating ... so gracefully and unmatched since that time!<U+FEFF>"
"471","Ravel","Очень красивая музыка.<U+FEFF>"
"472","Ravel","Тостяк башкой трусит ну прям так серьёзно. Скрипач<U+FEFF>"
"473","Ravel","Imagine trying to compose music for an orchestra it must take a great understanding of all the instruments , great respect to Ravel<U+FEFF>"
"474","Ravel","This gives me chills.<U+FEFF>"
"475","Ravel","How many guys out there had to listen to Bolero for 4 hours straight one night in college? Every time I hear it, I remember that long night. Great times, brothers.<U+FEFF>"
"476","Ravel","Simply mesmerizing.<U+FEFF>"
"477","Ravel","It's command and do..... even with a toothpick Maestro is fantastic in a great symphony by ravel!<U+FEFF>"
"478","Ravel","True, majestic splendor, it brings me joy!!!<U+FEFF>"
"479","Ravel","So the same thing over and over except the intensity of amplitude increases in such a way as to make it progressively more interesting, fascinating<U+FEFF>"
"480","Ravel","Oh this is great simphonia orchestra ,Bolero exellent <U+0001F44F><U+0001F44F><U+0001F44F><U+0001F44F><U+0001F44F><U+0001F44F><U+0001F44F><U+2764><U+FEFF>"
"481","Ravel","Someone coughed a few minutes in. Start over.<U+FEFF>"
"482","Ravel","My old time favorite  . Well don <U+0001F44D><U+FEFF>"
"483","Ravel","and also i think drummer screwed up at the first measure on snare haha... at 00:18 a missed hit... and first and second measure totally unstable...but the whole perform is aaaaah yeah good, it's okey...<U+FEFF>"
"484","Ravel","лайк, кто тоже в поисках русских коментов. Музыка прекрасна<U+FEFF>"
"485","Ravel","오늘은.. 매운맛이에요^..^<U+FEFF>"
"486","Ravel","Just incredible faces. He has mastered “the look”.<U+FEFF>"
"487","Ravel","カメラワ<U+30FC>ク最高<U+FEFF>"
"488","Ravel","Maurice Ravel Bolero London Symphony Orchestra Valery Gergiev
6<U+202F>026<U+202F>515 vues

42 K

2 K

PARTAGER

ENREGISTRER


세포
Ajoutee le 26 juil. 2014
설명

Maurice Ravel, Bolero for Orchestra
London Symphony Orchestra
Cond. Valery Gergiev<U+FEFF>"
"489","Ravel","Conductor and his intimacy and look is so profound!<U+FEFF>"
"490","Ravel","BRAVO <U+0001F44F> BRAVO <U+0001F3B6> <U+0001F1EC><U+0001F1E7><U+FEFF>"
"491","Ravel","Buyuk bir keyifle izliyorum gozlerim kapalı <U+015F>ahane bir eser eme<U+011F>i gecenlere te<U+015F>ekkurler <U+0130>zmir'den sevgiler saygılar sunuyorum efendim<U+FEFF>"
"492","Ravel","I would love to play this in my orchestra but I don't think it would go over too well when they heard that the song is fifteen minutes of the same melody
oh well<U+FEFF>"
"493","Ravel","From deliciously soft and sweet to brilliantly pulling the walls down in fifteen amazing minutes. Just fantastic!<U+FEFF>"
"494","Ravel","Class act<U+2757><U+FE0F>Power of  the human working together as one <U+0001F44D><U+FEFF>"
"495","Ravel","Божественная, чарующая музыка ,а МАЭСТРО Гергиев -чародей и маг!<U+FEFF>"
"496","Ravel","Such a beautiful melody<U+FEFF>"
"497","Ravel","Ingeniously!!! 15 minutes absolute bliss!<U+FEFF>"
"498","Ravel","That trumpet player is hella good. He sounds more pure than the clarinet and the oboe,which doesn’t often happen.<U+FEFF>"
"499","Ravel","It's not the size that matters, it's how you use it. A true statement in many aspects.<U+FEFF>"
"500","Ravel","3:04 love that whole part too<U+FEFF>"
"501","Ravel","One of the greatest pieces of classical music ever written.<U+FEFF>"
"502","Ravel","I was only 10 when 10 came out...i finally get it at 48<U+0001F602><U+0001F602><U+0001F602><U+0001F602><U+0001F602><U+0001F602><U+0001F602><U+0001F602><U+0001F602><U+0001F602><U+FEFF>"
"503","Ravel","It is one of the most beautiful songs of classical music, it is a masterpiece, I love it !!<U+FEFF>"
"504","Ravel","OMG 4:02 far violinist Frank Dixion (Stanley Tucci) from The Terminal!!! (Not really, he just looks a lot like him) :P<U+FEFF>"
"505","Ravel","A zene m<U+0171>veszete nem itt kezd<U+0151>dik, hanem itt vegz<U+0151>dik.Csodalatos ahogy atelik a hangszerek M<U+0170>VESZEI.Gralulalok,remek az egesz.<U+FEFF>"
"506","Ravel","""Bolero""
E um simbolo de perfeicao.<U+FEFF>"
"507","Ravel","je suis capable de l'ecouter dix fois a la suite !!! j'm autres trucs super ,ms dix fois de suite ,non!!!!!<U+FEFF>"
"508","Ravel","I'm not going to pretend for a second that I'm some kind of connoisseur or expert in classical music in any way.But this is completely awesome.One of those songs that make me feel feeble and inferior for not being able to play a musical instrument.What a magnificent and epic song.Ravel had a gift and thanks to the london symphony orchestra we are able to experience this today<U+FEFF>"
"509","Ravel","Слезы выступили. Без ценное исполнение.<U+FEFF>"
"510","Ravel","Jad and Robert sent me here.
Radiolab- go listen!<U+FEFF>"
"511","Ravel","As on 5-Jan-2019, this piece has been played by SINGAPORE Symphony Orchestra at the Esplanade Concert Hall, with the Prime Minister of the country and his wife among the audience, not forgetting the teen students from the school bands, mesmerized forever by the unison harmony played by all the musicians. Ah, the drummer again.<U+FEFF>"
"512","Ravel","Каждый раз пересматриваю это видео. Супер!!!!!!<U+FEFF>"
"513","Ravel","Thank you, Maurice Ravel.<U+FEFF>"
"514","Ravel","To me this is Iluvatars creation theme<U+FEFF>"
"515","Ravel","Хочется выматерится от восторга, но не смогу. Не получается... Потому что - это прекрасно! Во всех смыслах этого слова.<U+FEFF>"
"516","Ravel","Wouldn’t like to play a bum note for that conductor ,<U+0001F44A><U+0001F44A><U+FEFF>"
"517","Ravel","It's verry beautiful...!<U+FEFF>"
"518","Ravel","I had the Eb Clarinet solo in this song when I played it in college. :)<U+FEFF>"
"519","Ravel","I first heard about Ravel's Bolero when I was a child watching M*A*S*H...actually learned about a lot of famous actors as well.<U+FEFF>"
"520","Ravel","That guy has the funniest mimic I ever seen<U+FEFF>"
"521","Ravel","Molto molto coinvolgente. Gia il Bolero, di per se e un brano fantastico poi con questa Direzione, il Maestro gli da quel qualcosa in piu!!!! Beautiful!!!<U+FEFF>"
"522","Ravel","This is the REAL symphonic piece. Every instrument has its own part and importance.<U+FEFF>"
"523","Ravel","Jack Nicholson as conductor.<U+FEFF>"
"524","Ravel","Bolero is an inviting piece,  and I have just replaced my # one with this rendition.  God this is complete in it's delivery.  I could do this over again & not find a fault..  Sincerely, worth the time.  Thanks Maurice R.& V.G.<U+FEFF>"
"525","Ravel","I'm not sure what Legion is.
I'm here because this was going to be the theme for The Legend of Zelda.<U+FEFF>"
"526","Ravel","Beautiful, wonderful <U+2764><U+FE0F><U+FEFF>"
"527","Ravel","ПРИКОЛЬНЫЙ ДЕРИЖОР<U+FEFF>"
"528","Ravel","Look for another enterpretations of Bolero - This is THE BEST! Thanks for so colourful and unbelievebel music, Ravel, Valery Gergiev and all of London Symphony Orchestra musicians!!!<U+FEFF>"
"529","Ravel","First played on the 22 November 1928,  ninety years ago today<U+FEFF>"
"530","Ravel","Прекрасно!!!<U+FEFF>"
"531","Ravel","How could someone put a thumbs down...what are they deaf ??? BRAVO !!!<U+FEFF>"
"532","Ravel","This guy's conducting with a toothpick. Awesome<U+FEFF>"
"533","Ravel","What is this?  A baton for ants!?<U+FEFF>"
"534","Ravel","I heard the similar music in ""Dog fight 2 flash game""<U+FEFF>"
"535","Ravel","i dont even listen to orchestra-type music, but this is such a beautiful piece!<U+FEFF>"
"536","Ravel","For me this is the best Bolero performance in Youtube!! Sublime<U+2764><U+FE0F><U+FEFF>"
"537","Ravel","15:35 The end produces me an eargasm<U+FEFF>"
"538","Ravel","ГЕНИАЛЬНО!!!!!!!!!!БРАВО  МАЭСТРО!!!БЛАГОДАРЮ ВСЕХ!!!<U+FEFF>"
"539","Ravel","The rising intensity,  as the performance progresses, is breath taking<U+FEFF>"
"540","Ravel","This music is beautiful and connects us with something beyond this material plane.<U+FEFF>"
"541","Ravel","A great perform by the London Orchestra's, great execution of one of the best Ravel's music, a fantastic Bolero!<U+FEFF>"
"542","Ravel","Bolero is the ultimate crescendo<U+FEFF>"
"543","Ravel","Absolutamente maravilloso, mi alma y las que estan por ahi, agradecidas<U+FEFF>"
"544","Ravel","Bolero. Les souvenirs d""Andorre.
J'allais souvent en haut de col pymorens voir les chevaux sauvages.<U+FEFF>"
"545","Ravel","AND THEY CUT OFF THE APPLAUSE?!?!?!?!?!?!<U+FEFF>"
"546","Ravel","Brilliant. Well done to all. Thank you for sharing this.<U+FEFF>"
"547","Ravel","Joseph Maurice Ravel thank you for this. That's all.......thank you.<U+FEFF>"
"548","Ravel","Thank you so much indeed!<U+FEFF>"
"549","Ravel","Cuanto mas lo escucho mas me gusta.... simplemente maravilloso.<U+FEFF>"
"550","Ravel","I feel better every time I watch/listen to this particular performance...<U+FEFF>"
"551","Schonberg","00:00 <U+2013> Prelude
01:01 <U+2013> Gavotte
02:11 <U+2013> Musette (Gavotte da capo at 3:27)
04:37 <U+2013> Intermezzo
08:38 <U+2013> Menuet (and Trio at 10:23)
12:19 <U+2013> Gigue<U+FEFF>"
"552","Schonberg","Needs more cowbell<U+FEFF>"
"553","Schonberg","I grew up on Pollini's recording of the Suite for Piano.  This is a worthy performance.  Boffard is perhaps a little more sensitive than Pollini.  They each bring out different aspects of the Suite. This recording is, for me, a revelation.  I admit I have listened to Pollini for so long that I thought it was 'definitive'.  Now I know it is not.<U+FEFF>"
"554","Schonberg","i can play this, hold my beer<U+FEFF>"
"555","Schonberg","It is amazing to me how this piece has grown on me. When I first heard it many years ago as a teenager, I thought it was impossible to understand much less enjoy. Today I find it not only understandable but completely enjoyable. People whose tastes don't go beyond ""Stairway to Heaven"" will probably never learn to appreciate it, but this is one of the real works of genius in the history of music.<U+FEFF>"
"556","Schonberg","For me, nothing sounds academic in this suite; except perhaps the very beginning of he gavotte. Schoenberg applies to the series of 12 notes all the resources of his musical imagiination. I feel this suite easier to listen than say the perfectly tonal op. 9 and its dense contrapunctal effects rendrerd by a chamber orchestra. I would even sat that the pays betxeen a cell and its invesrion sound nice in that context.<U+FEFF>"
"557","Schonberg","Weponized music!!!<U+FEFF>"
"558","Schonberg","I know this music is not for everyone but I personally find it very compelling.<U+FEFF>"
"559","Schonberg","Is there any way you could upload the rest of this album? Boffard is spectacular!<U+FEFF>"
"560","Schonberg","Great playing!!!<U+FEFF>"
"561","Schonberg","The moment at 10:43 with sequence  E,Eb , G sounds very minor to me<U+FEFF>"
"562","Schonberg","wonderful to have the score here with the piano performance! Thank you!<U+FEFF>"
"563","Schonberg","I can't say I enjoy Schoenberg's early 12-tone works that much - I have various issues with the 12-tone system (other than ""it doesn't sound good""). That generally includes this piece, but I must say that this performance pulls it off surprisingly well. I can't say I'm loving it, but I don't hate it and I'm almost enjoying it.
I will say, I do enjoy Schoenberg's tonal works a lot (that first string quartet!) and some of his later 12-tone works (the concerti).<U+FEFF>"
"564","Schonberg","The interesting complexities he did very changing and the 12 tone.<U+FEFF>"
"565","Schonberg","Thank you for this.<U+FEFF>"
"566","Schonberg","I love 12 tone music!<U+FEFF>"
"567","Schonberg","Amazing performance.<U+FEFF>"
"568","Schonberg","Hi. Gigue.m33 - m37 excellent structure, sounds human and computer generated. Thank you. ~n8i<U+FEFF>"
"569","Schonberg","The Gavotte and Musette are just brilliant.<U+FEFF>"
"570","Schonberg","This sounds really playful at times because of the rhythm used actually<U+FEFF>"
"571","Schonberg","What I like about the Piano Suite--and what makes it easier listening than other piano works of Schoenberg--is the strong rhythmic element, with lively syncopations.<U+FEFF>"
"572","Schonberg","I'm in love with the musette...<U+FEFF>"
"573","Schonberg","Damn it I'm mad at how great 13:12 sounds for 3 seconds before going back to the rest of the dissonance<U+FEFF>"
"574","Schonberg","grandioso el dodecafonismo ¡¡¡<U+FEFF>"
"575","Schonberg","I never really liked serialism/shcoenberg until I read it and listened to it at the same time. Unreal craic.<U+FEFF>"
"576","Schonberg","This music gives me anxiety.<U+FEFF>"
"577","Schonberg","Outstanding interpretation !<U+FEFF>"
"578","Schonberg","It's a mockery of Bach<U+FEFF>"
"579","Schonberg","The great thing about this performance is how you hear the influence of Prokofiev (think Vision Fugitives) in Schoenberg's piano orchestration and the differing articulations of different lines. Although the language is very much Schoenberg's, the piano coloring (for lack of a better term)  is much of its time and like a good deal of Prokofiev's piano music, transcends it.<U+FEFF>"
"580","Schonberg","the gigue is simply irresistible! all the syncopated rhythms and tritones!! yessss<U+FEFF>"
"581","Schonberg","Splendid perfomance! Bravo Florent!<U+FEFF>"
"582","Schonberg","音<U+697D>の時聞かされたとき半<U+6570>が俺でも<U+5F3E>けるっていっとったわ<U+FEFF>"
